,sentence_good,sentence_bad,one_prefix_prefix,one_prefix_word_good,one_prefix_word_bad,field,linguistics_term,UID,simple_LM_method,one_prefix_method,two_prefix_method,lexically_identical,pairID,target,target_phrase
675,Sabrina isn't escaping from herself.,Sabrina isn't escaping from itself.,Sabrina isn't escaping from,herself,itself,morphology,anaphor_agreement,anaphor_gender_agreement,True,True,False,False,675,Sabrina,Sabrina
676,Karla isn't finding herself.,Karla isn't finding himself.,Karla isn't finding,herself,himself,morphology,anaphor_agreement,anaphor_gender_agreement,True,True,False,False,676,Karla,Karla
677,Gerald had worried himself.,Gerald had worried herself.,Gerald had worried,himself,herself,morphology,anaphor_agreement,anaphor_gender_agreement,True,True,False,False,677,Gerald,Gerald
678,A lady hasn't visited herself.,A lady hasn't visited himself.,A lady hasn't visited,herself,himself,morphology,anaphor_agreement,anaphor_gender_agreement,True,True,False,False,678,lady,A lady
679,Renee hadn't alarmed herself.,Renee hadn't alarmed himself.,Renee hadn't alarmed,herself,himself,morphology,anaphor_agreement,anaphor_gender_agreement,True,True,False,False,679,Renee,Renee
680,Sarah fires herself.,Sarah fires itself.,Sarah fires,herself,itself,morphology,anaphor_agreement,anaphor_gender_agreement,True,True,False,False,680,Sarah,Sarah
681,Sara hadn't fled from herself.,Sara hadn't fled from himself.,Sara hadn't fled from,herself,himself,morphology,anaphor_agreement,anaphor_gender_agreement,True,True,False,False,681,Sara,Sara
682,Anne upset herself.,Anne upset himself.,Anne upset,herself,himself,morphology,anaphor_agreement,anaphor_gender_agreement,True,True,False,False,682,Anne,Anne
683,Richard hadn't bored himself.,Richard hadn't bored herself.,Richard hadn't bored,himself,herself,morphology,anaphor_agreement,anaphor_gender_agreement,True,True,False,False,683,Richard,Richard
684,Rachel watched herself.,Rachel watched itself.,Rachel watched,herself,itself,morphology,anaphor_agreement,anaphor_gender_agreement,True,True,False,False,684,Rachel,Rachel
685,Samuel describes himself.,Samuel describes herself.,Samuel describes,himself,herself,morphology,anaphor_agreement,anaphor_gender_agreement,True,True,False,False,685,Samuel,Samuel
686,Natalie is shocking herself.,Natalie is shocking itself.,Natalie is shocking,herself,itself,morphology,anaphor_agreement,anaphor_gender_agreement,True,True,False,False,686,Natalie,Natalie
687,Karen didn't see herself.,Karen didn't see itself.,Karen didn't see,herself,itself,morphology,anaphor_agreement,anaphor_gender_agreement,True,True,False,False,687,Karen,Karen
688,Andrew did annoy himself.,Andrew did annoy itself.,Andrew did annoy,himself,itself,morphology,anaphor_agreement,anaphor_gender_agreement,True,True,False,False,688,Andrew,Andrew
689,Meredith was disgusting herself.,Meredith was disgusting himself.,Meredith was disgusting,herself,himself,morphology,anaphor_agreement,anaphor_gender_agreement,True,True,False,False,689,Meredith,Meredith
690,Margaret won't heal herself.,Margaret won't heal himself.,Margaret won't heal,herself,himself,morphology,anaphor_agreement,anaphor_gender_agreement,True,True,False,False,690,Margaret,Margaret
691,Raymond hasn't referenced himself.,Raymond hasn't referenced herself.,Raymond hasn't referenced,himself,herself,morphology,anaphor_agreement,anaphor_gender_agreement,True,True,False,False,691,Raymond,Raymond
692,Lawrence disturbed himself.,Lawrence disturbed itself.,Lawrence disturbed,himself,itself,morphology,anaphor_agreement,anaphor_gender_agreement,True,True,False,False,692,Lawrence,Lawrence
693,Clyde stunned himself.,Clyde stunned herself.,Clyde stunned,himself,herself,morphology,anaphor_agreement,anaphor_gender_agreement,True,True,False,False,693,Clyde,Clyde
694,Kevin hadn't concealed himself.,Kevin hadn't concealed itself.,Kevin hadn't concealed,himself,itself,morphology,anaphor_agreement,anaphor_gender_agreement,True,True,False,False,694,Kevin,Kevin
695,Veronica isn't attacking herself.,Veronica isn't attacking itself.,Veronica isn't attacking,herself,itself,morphology,anaphor_agreement,anaphor_gender_agreement,True,True,False,False,695,Veronica,Veronica
696,Larry discovered himself.,Larry discovered itself.,Larry discovered,himself,itself,morphology,anaphor_agreement,anaphor_gender_agreement,True,True,False,False,696,Larry,Larry
697,Natalie hadn't impressed herself.,Natalie hadn't impressed himself.,Natalie hadn't impressed,herself,himself,morphology,anaphor_agreement,anaphor_gender_agreement,True,True,False,False,697,Natalie,Natalie
698,Leslie hated herself.,Leslie hated himself.,Leslie hated,herself,himself,morphology,anaphor_agreement,anaphor_gender_agreement,True,True,False,False,698,Leslie,Leslie
699,Andrea isn't kissing herself.,Andrea isn't kissing himself.,Andrea isn't kissing,herself,himself,morphology,anaphor_agreement,anaphor_gender_agreement,True,True,False,False,699,Andrea,Andrea
700,Carrie noticed herself.,Carrie noticed itself.,Carrie noticed,herself,itself,morphology,anaphor_agreement,anaphor_gender_agreement,True,True,False,False,700,Carrie,Carrie
701,Beth has concealed herself.,Beth has concealed itself.,Beth has concealed,herself,itself,morphology,anaphor_agreement,anaphor_gender_agreement,True,True,False,False,701,Beth,Beth
702,Colleen was concealing herself.,Colleen was concealing itself.,Colleen was concealing,herself,itself,morphology,anaphor_agreement,anaphor_gender_agreement,True,True,False,False,702,Colleen,Colleen
703,Nicole had annoyed herself.,Nicole had annoyed itself.,Nicole had annoyed,herself,itself,morphology,anaphor_agreement,anaphor_gender_agreement,True,True,False,False,703,Nicole,Nicole
704,Charles isn't thinking about himself.,Charles isn't thinking about herself.,Charles isn't thinking about,himself,herself,morphology,anaphor_agreement,anaphor_gender_agreement,True,True,False,False,704,Charles,Charles
705,Some lady isn't bothering herself.,Some lady isn't bothering himself.,Some lady isn't bothering,herself,himself,morphology,anaphor_agreement,anaphor_gender_agreement,True,True,False,False,705,lady,Some lady
706,Douglas wouldn't confuse himself.,Douglas wouldn't confuse itself.,Douglas wouldn't confuse,himself,itself,morphology,anaphor_agreement,anaphor_gender_agreement,True,True,False,False,706,Douglas,Douglas
707,Ann can shock herself.,Ann can shock himself.,Ann can shock,herself,himself,morphology,anaphor_agreement,anaphor_gender_agreement,True,True,False,False,707,Ann,Ann
708,Noah knows himself.,Noah knows herself.,Noah knows,himself,herself,morphology,anaphor_agreement,anaphor_gender_agreement,True,True,False,False,708,Noah,Noah
709,Eva heals herself.,Eva heals itself.,Eva heals,herself,itself,morphology,anaphor_agreement,anaphor_gender_agreement,True,True,False,False,709,NA,NA
710,Theodore wasn't revealing himself.,Theodore wasn't revealing herself.,Theodore wasn't revealing,himself,herself,morphology,anaphor_agreement,anaphor_gender_agreement,True,True,False,False,710,Theodore,Theodore
711,Donna hasn't observed herself.,Donna hasn't observed itself.,Donna hasn't observed,herself,itself,morphology,anaphor_agreement,anaphor_gender_agreement,True,True,False,False,711,Donna,Donna
712,Vincent will alarm himself.,Vincent will alarm herself.,Vincent will alarm,himself,herself,morphology,anaphor_agreement,anaphor_gender_agreement,True,True,False,False,712,Vincent,Vincent
713,Connie has returned to herself.,Connie has returned to itself.,Connie has returned to,herself,itself,morphology,anaphor_agreement,anaphor_gender_agreement,True,True,False,False,713,Connie,Connie
714,Amanda insults herself.,Amanda insults himself.,Amanda insults,herself,himself,morphology,anaphor_agreement,anaphor_gender_agreement,True,True,False,False,714,Amanda,Amanda
715,Eva was disturbing herself.,Eva was disturbing itself.,Eva was disturbing,herself,itself,morphology,anaphor_agreement,anaphor_gender_agreement,True,True,False,False,715,Eva,Eva
716,Tamara has found herself.,Tamara has found himself.,Tamara has found,herself,himself,morphology,anaphor_agreement,anaphor_gender_agreement,True,True,False,False,716,Tamara,Tamara
717,Todd isn't talking to himself.,Todd isn't talking to itself.,Todd isn't talking to,himself,itself,morphology,anaphor_agreement,anaphor_gender_agreement,True,True,False,False,717,Todd,Todd
718,Elizabeth shouldn't argue about herself.,Elizabeth shouldn't argue about himself.,Elizabeth shouldn't argue about,herself,himself,morphology,anaphor_agreement,anaphor_gender_agreement,True,True,False,False,718,Elizabeth,Elizabeth
719,Kevin hasn't found himself.,Kevin hasn't found itself.,Kevin hasn't found,himself,itself,morphology,anaphor_agreement,anaphor_gender_agreement,True,True,False,False,719,Kevin,Kevin
720,That lady praises herself.,That lady praises himself.,That lady praises,herself,himself,morphology,anaphor_agreement,anaphor_gender_agreement,True,True,False,False,720,lady,That lady
721,Donna is scaring herself.,Donna is scaring himself.,Donna is scaring,herself,himself,morphology,anaphor_agreement,anaphor_gender_agreement,True,True,False,False,721,Donna,Donna
722,That guy hasn't respected himself.,That guy hasn't respected itself.,That guy hasn't respected,himself,itself,morphology,anaphor_agreement,anaphor_gender_agreement,True,True,False,False,722,guy,That guy
723,Russell isn't confusing himself.,Russell isn't confusing itself.,Russell isn't confusing,himself,itself,morphology,anaphor_agreement,anaphor_gender_agreement,True,True,False,False,723,Russell,Russell
724,Dan would love himself.,Dan would love herself.,Dan would love,himself,herself,morphology,anaphor_agreement,anaphor_gender_agreement,True,True,False,False,724,Dan,Dan
725,Mitchell flees from himself.,Mitchell flees from itself.,Mitchell flees from,himself,itself,morphology,anaphor_agreement,anaphor_gender_agreement,True,True,False,False,725,Mitchell,Mitchell
726,Ronald wasn't curing himself.,Ronald wasn't curing itself.,Ronald wasn't curing,himself,itself,morphology,anaphor_agreement,anaphor_gender_agreement,True,True,False,False,726,Ronald,Ronald
727,Florence upset herself.,Florence upset itself.,Florence upset,herself,itself,morphology,anaphor_agreement,anaphor_gender_agreement,True,True,False,False,727,Florence,Florence
728,Irene is disgusting herself.,Irene is disgusting itself.,Irene is disgusting,herself,itself,morphology,anaphor_agreement,anaphor_gender_agreement,True,True,False,False,728,Irene,Irene
729,Julia hugs herself.,Julia hugs itself.,Julia hugs,herself,itself,morphology,anaphor_agreement,anaphor_gender_agreement,True,True,False,False,729,Julia,Julia
730,Regina isn't visiting herself.,Regina isn't visiting itself.,Regina isn't visiting,herself,itself,morphology,anaphor_agreement,anaphor_gender_agreement,True,True,False,False,730,Regina,Regina
731,Lisa cured herself.,Lisa cured himself.,Lisa cured,herself,himself,morphology,anaphor_agreement,anaphor_gender_agreement,True,True,False,False,731,Lisa,Lisa
732,Laura would respect herself.,Laura would respect himself.,Laura would respect,herself,himself,morphology,anaphor_agreement,anaphor_gender_agreement,True,True,False,False,732,Laura,Laura
733,Noah hasn't fired himself.,Noah hasn't fired herself.,Noah hasn't fired,himself,herself,morphology,anaphor_agreement,anaphor_gender_agreement,True,True,False,False,733,Noah,Noah
734,Renee was referencing herself.,Renee was referencing itself.,Renee was referencing,herself,itself,morphology,anaphor_agreement,anaphor_gender_agreement,True,True,False,False,734,Renee,Renee
735,Rachelle isn't finding herself.,Rachelle isn't finding itself.,Rachelle isn't finding,herself,itself,morphology,anaphor_agreement,anaphor_gender_agreement,True,True,False,False,735,Rachelle,Rachelle
736,Wayne conceals himself.,Wayne conceals herself.,Wayne conceals,himself,herself,morphology,anaphor_agreement,anaphor_gender_agreement,True,True,False,False,736,Wayne,Wayne
737,Phillip isn't confusing himself.,Phillip isn't confusing itself.,Phillip isn't confusing,himself,itself,morphology,anaphor_agreement,anaphor_gender_agreement,True,True,False,False,737,Phillip,Phillip
738,Melinda found herself.,Melinda found himself.,Melinda found,herself,himself,morphology,anaphor_agreement,anaphor_gender_agreement,True,True,False,False,738,Melinda,Melinda
739,Tiffany hasn't discovered herself.,Tiffany hasn't discovered himself.,Tiffany hasn't discovered,herself,himself,morphology,anaphor_agreement,anaphor_gender_agreement,True,True,False,False,739,Tiffany,Tiffany
740,Roger wouldn't astound himself.,Roger wouldn't astound itself.,Roger wouldn't astound,himself,itself,morphology,anaphor_agreement,anaphor_gender_agreement,True,True,False,False,740,Roger,Roger
741,Carlos forgot himself.,Carlos forgot itself.,Carlos forgot,himself,itself,morphology,anaphor_agreement,anaphor_gender_agreement,True,True,False,False,741,Carlos,Carlos
742,Helen referenced herself.,Helen referenced himself.,Helen referenced,herself,himself,morphology,anaphor_agreement,anaphor_gender_agreement,True,True,False,False,742,Helen,Helen
743,Deanna is irritating herself.,Deanna is irritating himself.,Deanna is irritating,herself,himself,morphology,anaphor_agreement,anaphor_gender_agreement,True,True,False,False,743,Deanna,Deanna
744,Deborah should flee from herself.,Deborah should flee from himself.,Deborah should flee from,herself,himself,morphology,anaphor_agreement,anaphor_gender_agreement,True,True,False,False,744,Deborah,Deborah
745,Nicole is curing herself.,Nicole is curing itself.,Nicole is curing,herself,itself,morphology,anaphor_agreement,anaphor_gender_agreement,True,True,False,False,745,Nicole,Nicole
746,Holly hasn't appreciated herself.,Holly hasn't appreciated himself.,Holly hasn't appreciated,herself,himself,morphology,anaphor_agreement,anaphor_gender_agreement,True,True,False,False,746,Holly,Holly
747,Todd hasn't forgotten himself.,Todd hasn't forgotten itself.,Todd hasn't forgotten,himself,itself,morphology,anaphor_agreement,anaphor_gender_agreement,True,True,False,False,747,Todd,Todd
748,Carolyn irritated herself.,Carolyn irritated himself.,Carolyn irritated,herself,himself,morphology,anaphor_agreement,anaphor_gender_agreement,True,True,False,False,748,Carolyn,Carolyn
749,Kristin can't love herself.,Kristin can't love himself.,Kristin can't love,herself,himself,morphology,anaphor_agreement,anaphor_gender_agreement,True,True,False,False,749,Kristin,Kristin
750,Steven has disturbed himself.,Steven has disturbed herself.,Steven has disturbed,himself,herself,morphology,anaphor_agreement,anaphor_gender_agreement,True,True,False,False,750,Steven,Steven
751,Julia had upset herself.,Julia had upset itself.,Julia had upset,herself,itself,morphology,anaphor_agreement,anaphor_gender_agreement,True,True,False,False,751,Julia,Julia
752,Aaron wasn't hurting himself.,Aaron wasn't hurting itself.,Aaron wasn't hurting,himself,itself,morphology,anaphor_agreement,anaphor_gender_agreement,True,True,False,False,752,Aaron,Aaron
753,Every girl watched herself.,Every girl watched itself.,Every girl watched,herself,itself,morphology,anaphor_agreement,anaphor_gender_agreement,True,True,False,False,753,girl,Every girl
754,Liam worked with himself.,Liam worked with itself.,Liam worked with,himself,itself,morphology,anaphor_agreement,anaphor_gender_agreement,True,True,False,False,754,Liam,Liam
755,Janet wasn't questioning herself.,Janet wasn't questioning himself.,Janet wasn't questioning,herself,himself,morphology,anaphor_agreement,anaphor_gender_agreement,True,True,False,False,755,Janet,Janet
756,Jason should listen to himself.,Jason should listen to itself.,Jason should listen to,himself,itself,morphology,anaphor_agreement,anaphor_gender_agreement,True,True,False,False,756,Jason,Jason
757,Anne left herself.,Anne left itself.,Anne left,herself,itself,morphology,anaphor_agreement,anaphor_gender_agreement,True,True,False,False,757,Anne,Anne
758,Stephanie is returning to herself.,Stephanie is returning to itself.,Stephanie is returning to,herself,itself,morphology,anaphor_agreement,anaphor_gender_agreement,True,True,False,False,758,Stephanie,Stephanie
759,Rachel had argued about herself.,Rachel had argued about himself.,Rachel had argued about,herself,himself,morphology,anaphor_agreement,anaphor_gender_agreement,True,True,False,False,759,Rachel,Rachel
760,Roger could annoy himself.,Roger could annoy itself.,Roger could annoy,himself,itself,morphology,anaphor_agreement,anaphor_gender_agreement,True,True,False,False,760,Roger,Roger
761,Sandra was distracting herself.,Sandra was distracting itself.,Sandra was distracting,herself,itself,morphology,anaphor_agreement,anaphor_gender_agreement,True,True,False,False,761,Sandra,Sandra
762,Leslie isn't disturbing herself.,Leslie isn't disturbing itself.,Leslie isn't disturbing,herself,itself,morphology,anaphor_agreement,anaphor_gender_agreement,True,True,False,False,762,Leslie,Leslie
763,Andrea did stun herself.,Andrea did stun itself.,Andrea did stun,herself,itself,morphology,anaphor_agreement,anaphor_gender_agreement,True,True,False,False,763,Andrea,Andrea
764,Aaron remembered himself.,Aaron remembered herself.,Aaron remembered,himself,herself,morphology,anaphor_agreement,anaphor_gender_agreement,True,True,False,False,764,Aaron,Aaron
765,Angela is irritating herself.,Angela is irritating itself.,Angela is irritating,herself,itself,morphology,anaphor_agreement,anaphor_gender_agreement,True,True,False,False,765,Angela,Angela
766,Alan kisses himself.,Alan kisses herself.,Alan kisses,himself,herself,morphology,anaphor_agreement,anaphor_gender_agreement,True,True,False,False,766,Alan,Alan
767,Rebecca observes herself.,Rebecca observes itself.,Rebecca observes,herself,itself,morphology,anaphor_agreement,anaphor_gender_agreement,True,True,False,False,767,Rebecca,Rebecca
768,Maria admired herself.,Maria admired himself.,Maria admired,herself,himself,morphology,anaphor_agreement,anaphor_gender_agreement,True,True,False,False,768,Maria,Maria
769,Joel finds himself.,Joel finds herself.,Joel finds,himself,herself,morphology,anaphor_agreement,anaphor_gender_agreement,True,True,False,False,769,Joel,Joel
770,Joel did hire himself.,Joel did hire herself.,Joel did hire,himself,herself,morphology,anaphor_agreement,anaphor_gender_agreement,True,True,False,False,770,Joel,Joel
771,Andrea is concealing herself.,Andrea is concealing himself.,Andrea is concealing,herself,himself,morphology,anaphor_agreement,anaphor_gender_agreement,True,True,False,False,771,Andrea,Andrea
772,Allison isn't leaving herself.,Allison isn't leaving himself.,Allison isn't leaving,herself,himself,morphology,anaphor_agreement,anaphor_gender_agreement,True,True,False,False,772,Allison,Allison
773,Patricia conceals herself.,Patricia conceals itself.,Patricia conceals,herself,itself,morphology,anaphor_agreement,anaphor_gender_agreement,True,True,False,False,773,Patricia,Patricia
774,Stephen could dislike himself.,Stephen could dislike herself.,Stephen could dislike,himself,herself,morphology,anaphor_agreement,anaphor_gender_agreement,True,True,False,False,774,Stephen,Stephen
775,Julie has praised herself.,Julie has praised itself.,Julie has praised,herself,itself,morphology,anaphor_agreement,anaphor_gender_agreement,True,True,False,False,775,Julie,Julie
776,Gary talked about himself.,Gary talked about herself.,Gary talked about,himself,herself,morphology,anaphor_agreement,anaphor_gender_agreement,True,True,False,False,776,Gary,Gary
777,Martha was shocking herself.,Martha was shocking himself.,Martha was shocking,herself,himself,morphology,anaphor_agreement,anaphor_gender_agreement,True,True,False,False,777,Martha,Martha
778,That man hasn't found himself.,That man hasn't found itself.,That man hasn't found,himself,itself,morphology,anaphor_agreement,anaphor_gender_agreement,True,True,False,False,778,man,That man
779,Alice is distracting herself.,Alice is distracting itself.,Alice is distracting,herself,itself,morphology,anaphor_agreement,anaphor_gender_agreement,True,True,False,False,779,Alice,Alice
780,Some woman could insult herself.,Some woman could insult itself.,Some woman could insult,herself,itself,morphology,anaphor_agreement,anaphor_gender_agreement,True,True,False,False,780,woman,Some woman
781,Caroline boasts about herself.,Caroline boasts about itself.,Caroline boasts about,herself,itself,morphology,anaphor_agreement,anaphor_gender_agreement,True,True,False,False,781,Caroline,Caroline
782,Russell won't forget himself.,Russell won't forget itself.,Russell won't forget,himself,itself,morphology,anaphor_agreement,anaphor_gender_agreement,True,True,False,False,782,Russell,Russell
783,Theodore wouldn't return to himself.,Theodore wouldn't return to herself.,Theodore wouldn't return to,himself,herself,morphology,anaphor_agreement,anaphor_gender_agreement,True,True,False,False,783,Theodore,Theodore
784,Laura wasn't annoying herself.,Laura wasn't annoying itself.,Laura wasn't annoying,herself,itself,morphology,anaphor_agreement,anaphor_gender_agreement,True,True,False,False,784,Laura,Laura
785,Pamela is insulting herself.,Pamela is insulting itself.,Pamela is insulting,herself,itself,morphology,anaphor_agreement,anaphor_gender_agreement,True,True,False,False,785,Pamela,Pamela
786,Holly hadn't worried herself.,Holly hadn't worried itself.,Holly hadn't worried,herself,itself,morphology,anaphor_agreement,anaphor_gender_agreement,True,True,False,False,786,Holly,Holly
787,Christopher upset himself.,Christopher upset itself.,Christopher upset,himself,itself,morphology,anaphor_agreement,anaphor_gender_agreement,True,True,False,False,787,Christopher,Christopher
788,Diana couldn't bother herself.,Diana couldn't bother itself.,Diana couldn't bother,herself,itself,morphology,anaphor_agreement,anaphor_gender_agreement,True,True,False,False,788,Diana,Diana
789,Brian can't notice himself.,Brian can't notice itself.,Brian can't notice,himself,itself,morphology,anaphor_agreement,anaphor_gender_agreement,True,True,False,False,789,Brian,Brian
790,Lucille embarrassed herself.,Lucille embarrassed itself.,Lucille embarrassed,herself,itself,morphology,anaphor_agreement,anaphor_gender_agreement,True,True,False,False,790,Lucille,Lucille
791,Naomi had found herself.,Naomi had found himself.,Naomi had found,herself,himself,morphology,anaphor_agreement,anaphor_gender_agreement,True,True,False,False,791,Naomi,Naomi
792,Stephanie listens to herself.,Stephanie listens to itself.,Stephanie listens to,herself,itself,morphology,anaphor_agreement,anaphor_gender_agreement,True,True,False,False,792,Stephanie,Stephanie
793,Karen sees herself.,Karen sees himself.,Karen sees,herself,himself,morphology,anaphor_agreement,anaphor_gender_agreement,True,True,False,False,793,Karen,Karen
794,Joel isn't hurting himself.,Joel isn't hurting herself.,Joel isn't hurting,himself,herself,morphology,anaphor_agreement,anaphor_gender_agreement,True,True,False,False,794,Joel,Joel
795,Sarah discusses herself.,Sarah discusses himself.,Sarah discusses,herself,himself,morphology,anaphor_agreement,anaphor_gender_agreement,True,True,False,False,795,Sarah,Sarah
796,Amanda could praise herself.,Amanda could praise himself.,Amanda could praise,herself,himself,morphology,anaphor_agreement,anaphor_gender_agreement,True,True,False,False,796,Amanda,Amanda
797,Tara helped herself.,Tara helped himself.,Tara helped,herself,himself,morphology,anaphor_agreement,anaphor_gender_agreement,True,True,False,False,797,Tara,Tara
798,Samuel had hated himself.,Samuel had hated itself.,Samuel had hated,himself,itself,morphology,anaphor_agreement,anaphor_gender_agreement,True,True,False,False,798,Samuel,Samuel
799,Joel respected himself.,Joel respected itself.,Joel respected,himself,itself,morphology,anaphor_agreement,anaphor_gender_agreement,True,True,False,False,799,Joel,Joel
800,Ruth confused herself.,Ruth confused itself.,Ruth confused,herself,itself,morphology,anaphor_agreement,anaphor_gender_agreement,True,True,False,False,800,Ruth,Ruth
801,The dancer questioned herself.,The dancer questioned himself.,The dancer questioned,herself,himself,morphology,anaphor_agreement,anaphor_gender_agreement,True,True,False,False,801,dancer,The dancer
802,Ronald had admired himself.,Ronald had admired herself.,Ronald had admired,himself,herself,morphology,anaphor_agreement,anaphor_gender_agreement,True,True,False,False,802,Ronald,Ronald
803,Jill hasn't confused herself.,Jill hasn't confused itself.,Jill hasn't confused,herself,itself,morphology,anaphor_agreement,anaphor_gender_agreement,True,True,False,False,803,Jill,Jill
804,Tamara appreciates herself.,Tamara appreciates itself.,Tamara appreciates,herself,itself,morphology,anaphor_agreement,anaphor_gender_agreement,True,True,False,False,804,Tamara,Tamara
805,Teresa wouldn't return to herself.,Teresa wouldn't return to itself.,Teresa wouldn't return to,herself,itself,morphology,anaphor_agreement,anaphor_gender_agreement,True,True,False,False,805,Teresa,Teresa
806,Cynthia won't hug herself.,Cynthia won't hug itself.,Cynthia won't hug,herself,itself,morphology,anaphor_agreement,anaphor_gender_agreement,True,True,False,False,806,Cynthia,Cynthia
807,Tonya wasn't investigating herself.,Tonya wasn't investigating himself.,Tonya wasn't investigating,herself,himself,morphology,anaphor_agreement,anaphor_gender_agreement,True,True,False,False,807,Tonya,Tonya
808,Jill wasn't praising herself.,Jill wasn't praising itself.,Jill wasn't praising,herself,itself,morphology,anaphor_agreement,anaphor_gender_agreement,True,True,False,False,808,Jill,Jill
809,Jane had remembered herself.,Jane had remembered himself.,Jane had remembered,herself,himself,morphology,anaphor_agreement,anaphor_gender_agreement,True,True,False,False,809,Jane,Jane
810,Judy wasn't hurting herself.,Judy wasn't hurting itself.,Judy wasn't hurting,herself,itself,morphology,anaphor_agreement,anaphor_gender_agreement,True,True,False,False,810,Judy,Judy
