,sentence_good,sentence_bad,one_prefix_prefix,one_prefix_word_good,one_prefix_word_bad,field,linguistics_term,UID,simple_LM_method,one_prefix_method,two_prefix_method,lexically_identical,pairID,target,target_phrase
0,Katherine can't help herself.,Katherine can't help himself.,Katherine can't help,herself,himself,morphology,anaphor_agreement,anaphor_gender_agreement,True,True,False,False,0,Katherine,Katherine
1,Karla could listen to herself.,Karla could listen to himself.,Karla could listen to,herself,himself,morphology,anaphor_agreement,anaphor_gender_agreement,True,True,False,False,1,Karla,Karla
2,Marie won't think about herself.,Marie won't think about itself.,Marie won't think about,herself,itself,morphology,anaphor_agreement,anaphor_gender_agreement,True,True,False,False,2,Marie,Marie
3,Mark hasn't discussed himself.,Mark hasn't discussed itself.,Mark hasn't discussed,himself,itself,morphology,anaphor_agreement,anaphor_gender_agreement,True,True,False,False,3,Mark,Mark
4,Stephen impressed himself.,Stephen impressed itself.,Stephen impressed,himself,itself,morphology,anaphor_agreement,anaphor_gender_agreement,True,True,False,False,4,Stephen,Stephen
5,Christina boasts about herself.,Christina boasts about himself.,Christina boasts about,herself,himself,morphology,anaphor_agreement,anaphor_gender_agreement,True,True,False,False,5,Christina,Christina
6,Suzanne would irritate herself.,Suzanne would irritate itself.,Suzanne would irritate,herself,itself,morphology,anaphor_agreement,anaphor_gender_agreement,True,True,False,False,6,Suzanne,Suzanne
7,Rose couldn't reference herself.,Rose couldn't reference itself.,Rose couldn't reference,herself,itself,morphology,anaphor_agreement,anaphor_gender_agreement,True,True,False,False,7,NA,NA
8,Paul should stun himself.,Paul should stun herself.,Paul should stun,himself,herself,morphology,anaphor_agreement,anaphor_gender_agreement,True,True,False,False,8,Paul,Paul
9,Kristen praises herself.,Kristen praises himself.,Kristen praises,herself,himself,morphology,anaphor_agreement,anaphor_gender_agreement,True,True,False,False,9,Kristen,Kristen
10,Tamara might work with herself.,Tamara might work with himself.,Tamara might work with,herself,himself,morphology,anaphor_agreement,anaphor_gender_agreement,True,True,False,False,10,Tamara,Tamara
11,Valerie remembers herself.,Valerie remembers itself.,Valerie remembers,herself,itself,morphology,anaphor_agreement,anaphor_gender_agreement,True,True,False,False,11,Valerie,Valerie
12,Kristen hasn't worked with herself.,Kristen hasn't worked with itself.,Kristen hasn't worked with,herself,itself,morphology,anaphor_agreement,anaphor_gender_agreement,True,True,False,False,12,Kristen,Kristen
13,Kendra disturbed herself.,Kendra disturbed himself.,Kendra disturbed,herself,himself,morphology,anaphor_agreement,anaphor_gender_agreement,True,True,False,False,13,Kendra,Kendra
14,Lawrence had boasted about himself.,Lawrence had boasted about herself.,Lawrence had boasted about,himself,herself,morphology,anaphor_agreement,anaphor_gender_agreement,True,True,False,False,14,Lawrence,Lawrence
15,Jason wasn't listening to himself.,Jason wasn't listening to herself.,Jason wasn't listening to,himself,herself,morphology,anaphor_agreement,anaphor_gender_agreement,True,True,False,False,15,Jason,Jason
16,Sabrina disturbs herself.,Sabrina disturbs himself.,Sabrina disturbs,herself,himself,morphology,anaphor_agreement,anaphor_gender_agreement,True,True,False,False,16,Sabrina,Sabrina
17,Some essay doesn't disagree with itself.,Some essay doesn't disagree with himself.,Some essay doesn't disagree with,itself,himself,morphology,anaphor_agreement,anaphor_gender_agreement,True,True,False,False,17,essay,Some essay
18,Kenneth wasn't admiring himself.,Kenneth wasn't admiring itself.,Kenneth wasn't admiring,himself,itself,morphology,anaphor_agreement,anaphor_gender_agreement,True,True,False,False,18,Kenneth,Kenneth
19,Melanie had referenced herself.,Melanie had referenced itself.,Melanie had referenced,herself,itself,morphology,anaphor_agreement,anaphor_gender_agreement,True,True,False,False,19,Melanie,Melanie
20,Larry reveals himself.,Larry reveals itself.,Larry reveals,himself,itself,morphology,anaphor_agreement,anaphor_gender_agreement,True,True,False,False,20,Larry,Larry
21,Samantha isn't watching herself.,Samantha isn't watching itself.,Samantha isn't watching,herself,itself,morphology,anaphor_agreement,anaphor_gender_agreement,True,True,False,False,21,Samantha,Samantha
22,Rachel should like herself.,Rachel should like himself.,Rachel should like,herself,himself,morphology,anaphor_agreement,anaphor_gender_agreement,True,True,False,False,22,Rachel,Rachel
23,Heather has helped herself.,Heather has helped itself.,Heather has helped,herself,itself,morphology,anaphor_agreement,anaphor_gender_agreement,True,True,False,False,23,Heather,Heather
24,Lori has found herself.,Lori has found itself.,Lori has found,herself,itself,morphology,anaphor_agreement,anaphor_gender_agreement,True,True,False,False,24,Lori,Lori
25,Christina hadn't shocked herself.,Christina hadn't shocked itself.,Christina hadn't shocked,herself,itself,morphology,anaphor_agreement,anaphor_gender_agreement,True,True,False,False,25,Christina,Christina
26,Theresa wasn't alarming herself.,Theresa wasn't alarming himself.,Theresa wasn't alarming,herself,himself,morphology,anaphor_agreement,anaphor_gender_agreement,True,True,False,False,26,Theresa,Theresa
27,Jacqueline works with herself.,Jacqueline works with himself.,Jacqueline works with,herself,himself,morphology,anaphor_agreement,anaphor_gender_agreement,True,True,False,False,27,Jacqueline,Jacqueline
28,Alan hires himself.,Alan hires herself.,Alan hires,himself,herself,morphology,anaphor_agreement,anaphor_gender_agreement,True,True,False,False,28,Alan,Alan
29,April isn't complaining about herself.,April isn't complaining about himself.,April isn't complaining about,herself,himself,morphology,anaphor_agreement,anaphor_gender_agreement,True,True,False,False,29,NA,NA
30,Scott had questioned himself.,Scott had questioned herself.,Scott had questioned,himself,herself,morphology,anaphor_agreement,anaphor_gender_agreement,True,True,False,False,30,Scott,Scott
31,Wayne helps himself.,Wayne helps itself.,Wayne helps,himself,itself,morphology,anaphor_agreement,anaphor_gender_agreement,True,True,False,False,31,Wayne,Wayne
32,Amelia heals herself.,Amelia heals himself.,Amelia heals,herself,himself,morphology,anaphor_agreement,anaphor_gender_agreement,True,True,False,False,32,Amelia,Amelia
33,Debra is disgusting herself.,Debra is disgusting itself.,Debra is disgusting,herself,itself,morphology,anaphor_agreement,anaphor_gender_agreement,True,True,False,False,33,Debra,Debra
34,Irene has admired herself.,Irene has admired himself.,Irene has admired,herself,himself,morphology,anaphor_agreement,anaphor_gender_agreement,True,True,False,False,34,Irene,Irene
35,Brad distracted himself.,Brad distracted herself.,Brad distracted,himself,herself,morphology,anaphor_agreement,anaphor_gender_agreement,True,True,False,False,35,Brad,Brad
36,Sherry wouldn't cure herself.,Sherry wouldn't cure itself.,Sherry wouldn't cure,herself,itself,morphology,anaphor_agreement,anaphor_gender_agreement,True,True,False,False,36,Sherry,Sherry
37,Ronald upset himself.,Ronald upset itself.,Ronald upset,himself,itself,morphology,anaphor_agreement,anaphor_gender_agreement,True,True,False,False,37,Ronald,Ronald
38,Catherine hasn't noticed herself.,Catherine hasn't noticed himself.,Catherine hasn't noticed,herself,himself,morphology,anaphor_agreement,anaphor_gender_agreement,True,True,False,False,38,Catherine,Catherine
39,Susan shouldn't criticize herself.,Susan shouldn't criticize himself.,Susan shouldn't criticize,herself,himself,morphology,anaphor_agreement,anaphor_gender_agreement,True,True,False,False,39,Susan,Susan
40,Dawn has described herself.,Dawn has described himself.,Dawn has described,herself,himself,morphology,anaphor_agreement,anaphor_gender_agreement,True,True,False,False,40,Dawn,Dawn
41,Joseph describes himself.,Joseph describes herself.,Joseph describes,himself,herself,morphology,anaphor_agreement,anaphor_gender_agreement,True,True,False,False,41,Joseph,Joseph
42,Catherine isn't hurting herself.,Catherine isn't hurting himself.,Catherine isn't hurting,herself,himself,morphology,anaphor_agreement,anaphor_gender_agreement,True,True,False,False,42,Catherine,Catherine
43,Tracy alarmed herself.,Tracy alarmed itself.,Tracy alarmed,herself,itself,morphology,anaphor_agreement,anaphor_gender_agreement,True,True,False,False,43,Tracy,Tracy
44,Heather has embarrassed herself.,Heather has embarrassed himself.,Heather has embarrassed,herself,himself,morphology,anaphor_agreement,anaphor_gender_agreement,True,True,False,False,44,Heather,Heather
45,Sharon hurt herself.,Sharon hurt itself.,Sharon hurt,herself,itself,morphology,anaphor_agreement,anaphor_gender_agreement,True,True,False,False,45,Sharon,Sharon
46,Marie might admire herself.,Marie might admire himself.,Marie might admire,herself,himself,morphology,anaphor_agreement,anaphor_gender_agreement,True,True,False,False,46,Marie,Marie
47,Susan did love herself.,Susan did love itself.,Susan did love,herself,itself,morphology,anaphor_agreement,anaphor_gender_agreement,True,True,False,False,47,Susan,Susan
48,Russell hasn't hired himself.,Russell hasn't hired herself.,Russell hasn't hired,himself,herself,morphology,anaphor_agreement,anaphor_gender_agreement,True,True,False,False,48,Russell,Russell
49,Every man insulted himself.,Every man insulted itself.,Every man insulted,himself,itself,morphology,anaphor_agreement,anaphor_gender_agreement,True,True,False,False,49,man,Every man
50,Marie had insulted herself.,Marie had insulted himself.,Marie had insulted,herself,himself,morphology,anaphor_agreement,anaphor_gender_agreement,True,True,False,False,50,Marie,Marie
51,Steve wasn't describing himself.,Steve wasn't describing itself.,Steve wasn't describing,himself,itself,morphology,anaphor_agreement,anaphor_gender_agreement,True,True,False,False,51,Steve,Steve
52,Roger had known himself.,Roger had known herself.,Roger had known,himself,herself,morphology,anaphor_agreement,anaphor_gender_agreement,True,True,False,False,52,Roger,Roger
53,Larry boasts about himself.,Larry boasts about herself.,Larry boasts about,himself,herself,morphology,anaphor_agreement,anaphor_gender_agreement,True,True,False,False,53,Larry,Larry
54,Kayla complains about herself.,Kayla complains about himself.,Kayla complains about,herself,himself,morphology,anaphor_agreement,anaphor_gender_agreement,True,True,False,False,54,Kayla,Kayla
55,A bird had found itself.,A bird had found herself.,A bird had found,itself,herself,morphology,anaphor_agreement,anaphor_gender_agreement,True,True,False,False,55,bird,A bird
56,Ellen wasn't worrying herself.,Ellen wasn't worrying himself.,Ellen wasn't worrying,herself,himself,morphology,anaphor_agreement,anaphor_gender_agreement,True,True,False,False,56,Ellen,Ellen
57,Debra wasn't investigating herself.,Debra wasn't investigating itself.,Debra wasn't investigating,herself,itself,morphology,anaphor_agreement,anaphor_gender_agreement,True,True,False,False,57,Debra,Debra
58,Larry referenced himself.,Larry referenced herself.,Larry referenced,himself,herself,morphology,anaphor_agreement,anaphor_gender_agreement,True,True,False,False,58,Larry,Larry
59,Joel does complain about himself.,Joel does complain about herself.,Joel does complain about,himself,herself,morphology,anaphor_agreement,anaphor_gender_agreement,True,True,False,False,59,Joel,Joel
60,Gregory won't attack himself.,Gregory won't attack itself.,Gregory won't attack,himself,itself,morphology,anaphor_agreement,anaphor_gender_agreement,True,True,False,False,60,Gregory,Gregory
61,Christine hasn't questioned herself.,Christine hasn't questioned himself.,Christine hasn't questioned,herself,himself,morphology,anaphor_agreement,anaphor_gender_agreement,True,True,False,False,61,Christine,Christine
62,Natalie returned to herself.,Natalie returned to itself.,Natalie returned to,herself,itself,morphology,anaphor_agreement,anaphor_gender_agreement,True,True,False,False,62,Natalie,Natalie
63,Becca was approaching herself.,Becca was approaching himself.,Becca was approaching,herself,himself,morphology,anaphor_agreement,anaphor_gender_agreement,True,True,False,False,63,Becca,Becca
64,Rachelle investigated herself.,Rachelle investigated himself.,Rachelle investigated,herself,himself,morphology,anaphor_agreement,anaphor_gender_agreement,True,True,False,False,64,Rachelle,Rachelle
65,Sheila saw herself.,Sheila saw himself.,Sheila saw,herself,himself,morphology,anaphor_agreement,anaphor_gender_agreement,True,True,False,False,65,Sheila,Sheila
66,Jacqueline likes herself.,Jacqueline likes himself.,Jacqueline likes,herself,himself,morphology,anaphor_agreement,anaphor_gender_agreement,True,True,False,False,66,Jacqueline,Jacqueline
67,Douglas healed himself.,Douglas healed herself.,Douglas healed,himself,herself,morphology,anaphor_agreement,anaphor_gender_agreement,True,True,False,False,67,Douglas,Douglas
68,Colleen wasn't concealing herself.,Colleen wasn't concealing itself.,Colleen wasn't concealing,herself,itself,morphology,anaphor_agreement,anaphor_gender_agreement,True,True,False,False,68,Colleen,Colleen
69,Catherine disturbed herself.,Catherine disturbed itself.,Catherine disturbed,herself,itself,morphology,anaphor_agreement,anaphor_gender_agreement,True,True,False,False,69,Catherine,Catherine
70,Some company astounded itself.,Some company astounded herself.,Some company astounded,itself,herself,morphology,anaphor_agreement,anaphor_gender_agreement,True,True,False,False,70,company,Some company
71,Todd likes himself.,Todd likes itself.,Todd likes,himself,itself,morphology,anaphor_agreement,anaphor_gender_agreement,True,True,False,False,71,Todd,Todd
72,Tamara couldn't flee from herself.,Tamara couldn't flee from himself.,Tamara couldn't flee from,herself,himself,morphology,anaphor_agreement,anaphor_gender_agreement,True,True,False,False,72,Tamara,Tamara
73,Rose praised herself.,Rose praised himself.,Rose praised,herself,himself,morphology,anaphor_agreement,anaphor_gender_agreement,True,True,False,False,73,NA,NA
74,Joseph isn't annoying himself.,Joseph isn't annoying herself.,Joseph isn't annoying,himself,herself,morphology,anaphor_agreement,anaphor_gender_agreement,True,True,False,False,74,Joseph,Joseph
75,Jodi liked herself.,Jodi liked itself.,Jodi liked,herself,itself,morphology,anaphor_agreement,anaphor_gender_agreement,True,True,False,False,75,Jodi,Jodi
76,Ronald fled from himself.,Ronald fled from herself.,Ronald fled from,himself,herself,morphology,anaphor_agreement,anaphor_gender_agreement,True,True,False,False,76,Ronald,Ronald
77,Tina fires herself.,Tina fires himself.,Tina fires,herself,himself,morphology,anaphor_agreement,anaphor_gender_agreement,True,True,False,False,77,Tina,Tina
78,Michelle saw herself.,Michelle saw itself.,Michelle saw,herself,itself,morphology,anaphor_agreement,anaphor_gender_agreement,True,True,False,False,78,Michelle,Michelle
79,Renee might admire herself.,Renee might admire itself.,Renee might admire,herself,itself,morphology,anaphor_agreement,anaphor_gender_agreement,True,True,False,False,79,Renee,Renee
80,A girl couldn't reveal herself.,A girl couldn't reveal himself.,A girl couldn't reveal,herself,himself,morphology,anaphor_agreement,anaphor_gender_agreement,True,True,False,False,80,girl,A girl
81,Curtis won't describe himself.,Curtis won't describe itself.,Curtis won't describe,himself,itself,morphology,anaphor_agreement,anaphor_gender_agreement,True,True,False,False,81,Curtis,Curtis
82,Patricia does respect herself.,Patricia does respect himself.,Patricia does respect,herself,himself,morphology,anaphor_agreement,anaphor_gender_agreement,True,True,False,False,82,Patricia,Patricia
83,Valerie forgets herself.,Valerie forgets itself.,Valerie forgets,herself,itself,morphology,anaphor_agreement,anaphor_gender_agreement,True,True,False,False,83,Valerie,Valerie
84,Deborah had annoyed herself.,Deborah had annoyed himself.,Deborah had annoyed,herself,himself,morphology,anaphor_agreement,anaphor_gender_agreement,True,True,False,False,84,Deborah,Deborah
85,Clyde hasn't hated himself.,Clyde hasn't hated itself.,Clyde hasn't hated,himself,itself,morphology,anaphor_agreement,anaphor_gender_agreement,True,True,False,False,85,Clyde,Clyde
86,Andrea does kiss herself.,Andrea does kiss itself.,Andrea does kiss,herself,itself,morphology,anaphor_agreement,anaphor_gender_agreement,True,True,False,False,86,Andrea,Andrea
87,Irene isn't irritating herself.,Irene isn't irritating itself.,Irene isn't irritating,herself,itself,morphology,anaphor_agreement,anaphor_gender_agreement,True,True,False,False,87,Irene,Irene
88,Stacy hadn't sounded like herself.,Stacy hadn't sounded like itself.,Stacy hadn't sounded like,herself,itself,morphology,anaphor_agreement,anaphor_gender_agreement,True,True,False,False,88,Stacy,Stacy
89,Rose has shocked herself.,Rose has shocked itself.,Rose has shocked,herself,itself,morphology,anaphor_agreement,anaphor_gender_agreement,True,True,False,False,89,NA,NA
90,George wasn't hurting himself.,George wasn't hurting itself.,George wasn't hurting,himself,itself,morphology,anaphor_agreement,anaphor_gender_agreement,True,True,False,False,90,George,George
91,Amy would question herself.,Amy would question himself.,Amy would question,herself,himself,morphology,anaphor_agreement,anaphor_gender_agreement,True,True,False,False,91,Amy,Amy
92,Tonya sees herself.,Tonya sees itself.,Tonya sees,herself,itself,morphology,anaphor_agreement,anaphor_gender_agreement,True,True,False,False,92,Tonya,Tonya
93,Christina hasn't hired herself.,Christina hasn't hired himself.,Christina hasn't hired,herself,himself,morphology,anaphor_agreement,anaphor_gender_agreement,True,True,False,False,93,Christina,Christina
94,Pamela did reveal herself.,Pamela did reveal himself.,Pamela did reveal,herself,himself,morphology,anaphor_agreement,anaphor_gender_agreement,True,True,False,False,94,Pamela,Pamela
95,Diane had concealed herself.,Diane had concealed himself.,Diane had concealed,herself,himself,morphology,anaphor_agreement,anaphor_gender_agreement,True,True,False,False,95,Diane,Diane
96,Melinda hasn't argued about herself.,Melinda hasn't argued about itself.,Melinda hasn't argued about,herself,itself,morphology,anaphor_agreement,anaphor_gender_agreement,True,True,False,False,96,Melinda,Melinda
97,Deanna insults herself.,Deanna insults itself.,Deanna insults,herself,itself,morphology,anaphor_agreement,anaphor_gender_agreement,True,True,False,False,97,Deanna,Deanna
98,Gregory isn't hurting himself.,Gregory isn't hurting herself.,Gregory isn't hurting,himself,herself,morphology,anaphor_agreement,anaphor_gender_agreement,True,True,False,False,98,Gregory,Gregory
99,Rebecca should shock herself.,Rebecca should shock himself.,Rebecca should shock,herself,himself,morphology,anaphor_agreement,anaphor_gender_agreement,True,True,False,False,99,Rebecca,Rebecca
100,Amanda stunned herself.,Amanda stunned itself.,Amanda stunned,herself,itself,morphology,anaphor_agreement,anaphor_gender_agreement,True,True,False,False,100,Amanda,Amanda
101,That dancer wouldn't aggravate herself.,That dancer wouldn't aggravate himself.,That dancer wouldn't aggravate,herself,himself,morphology,anaphor_agreement,anaphor_gender_agreement,True,True,False,False,101,dancer,That dancer
102,Colleen talks to herself.,Colleen talks to itself.,Colleen talks to,herself,itself,morphology,anaphor_agreement,anaphor_gender_agreement,True,True,False,False,102,Colleen,Colleen talks to herself
103,Brian hasn't healed himself.,Brian hasn't healed itself.,Brian hasn't healed,himself,itself,morphology,anaphor_agreement,anaphor_gender_agreement,True,True,False,False,103,Brian,Brian
104,Natalie is curing herself.,Natalie is curing himself.,Natalie is curing,herself,himself,morphology,anaphor_agreement,anaphor_gender_agreement,True,True,False,False,104,Natalie,Natalie
105,Rhonda was upsetting herself.,Rhonda was upsetting himself.,Rhonda was upsetting,herself,himself,morphology,anaphor_agreement,anaphor_gender_agreement,True,True,False,False,105,Rhonda,Rhonda
106,Peter wasn't disgusting himself.,Peter wasn't disgusting herself.,Peter wasn't disgusting,himself,herself,morphology,anaphor_agreement,anaphor_gender_agreement,True,True,False,False,106,Peter,Peter
107,Kristen isn't aggravating herself.,Kristen isn't aggravating itself.,Kristen isn't aggravating,herself,itself,morphology,anaphor_agreement,anaphor_gender_agreement,True,True,False,False,107,Kristen,Kristen
108,Victoria hid herself.,Victoria hid himself.,Victoria hid,herself,himself,morphology,anaphor_agreement,anaphor_gender_agreement,True,True,False,False,108,hid,Victoria hid
109,Becca has seen herself.,Becca has seen himself.,Becca has seen,herself,himself,morphology,anaphor_agreement,anaphor_gender_agreement,True,True,False,False,109,Becca,Becca
110,Sherry can't forget herself.,Sherry can't forget himself.,Sherry can't forget,herself,himself,morphology,anaphor_agreement,anaphor_gender_agreement,True,True,False,False,110,Sherry,Sherry
111,Tracy had distracted herself.,Tracy had distracted itself.,Tracy had distracted,herself,itself,morphology,anaphor_agreement,anaphor_gender_agreement,True,True,False,False,111,Tracy,Tracy
112,Stephanie is talking to herself.,Stephanie is talking to himself.,Stephanie is talking to,herself,himself,morphology,anaphor_agreement,anaphor_gender_agreement,True,True,False,False,112,Stephanie,Stephanie
113,Rachelle might return to herself.,Rachelle might return to itself.,Rachelle might return to,herself,itself,morphology,anaphor_agreement,anaphor_gender_agreement,True,True,False,False,113,Rachelle,Rachelle
114,Carl describes himself.,Carl describes herself.,Carl describes,himself,herself,morphology,anaphor_agreement,anaphor_gender_agreement,True,True,False,False,114,Carl,Carl
115,Jeffrey didn't describe himself.,Jeffrey didn't describe herself.,Jeffrey didn't describe,himself,herself,morphology,anaphor_agreement,anaphor_gender_agreement,True,True,False,False,115,Jeffrey,Jeffrey
116,Jacqueline hadn't concealed herself.,Jacqueline hadn't concealed itself.,Jacqueline hadn't concealed,herself,itself,morphology,anaphor_agreement,anaphor_gender_agreement,True,True,False,False,116,Jacqueline,Jacqueline
117,Tracy isn't upsetting herself.,Tracy isn't upsetting itself.,Tracy isn't upsetting,herself,itself,morphology,anaphor_agreement,anaphor_gender_agreement,True,True,False,False,117,Tracy,Tracy
118,Sonia hasn't discovered herself.,Sonia hasn't discovered himself.,Sonia hasn't discovered,herself,himself,morphology,anaphor_agreement,anaphor_gender_agreement,True,True,False,False,118,Sonia,Sonia
119,Laura does find herself.,Laura does find himself.,Laura does find,herself,himself,morphology,anaphor_agreement,anaphor_gender_agreement,True,True,False,False,119,Laura,Laura
120,Jodi is confusing herself.,Jodi is confusing himself.,Jodi is confusing,herself,himself,morphology,anaphor_agreement,anaphor_gender_agreement,True,True,False,False,120,Jodi,Jodi
121,Florence disliked herself.,Florence disliked himself.,Florence disliked,herself,himself,morphology,anaphor_agreement,anaphor_gender_agreement,True,True,False,False,121,Florence,Florence
122,Alexander complains about himself.,Alexander complains about herself.,Alexander complains about,himself,herself,morphology,anaphor_agreement,anaphor_gender_agreement,True,True,False,False,122,Alexander,Alexander
123,Melissa complains about herself.,Melissa complains about itself.,Melissa complains about,herself,itself,morphology,anaphor_agreement,anaphor_gender_agreement,True,True,False,False,123,Melissa,Melissa
124,Teresa isn't noticing herself.,Teresa isn't noticing itself.,Teresa isn't noticing,herself,itself,morphology,anaphor_agreement,anaphor_gender_agreement,True,True,False,False,124,Teresa,Teresa
125,Jerry should cure himself.,Jerry should cure herself.,Jerry should cure,himself,herself,morphology,anaphor_agreement,anaphor_gender_agreement,True,True,False,False,125,Jerry,Jerry
126,Tanya was kissing herself.,Tanya was kissing himself.,Tanya was kissing,herself,himself,morphology,anaphor_agreement,anaphor_gender_agreement,True,True,False,False,126,Tanya,Tanya
127,Todd was scaring himself.,Todd was scaring itself.,Todd was scaring,himself,itself,morphology,anaphor_agreement,anaphor_gender_agreement,True,True,False,False,127,Todd,Todd
128,Sheila was noticing herself.,Sheila was noticing himself.,Sheila was noticing,herself,himself,morphology,anaphor_agreement,anaphor_gender_agreement,True,True,False,False,128,Sheila,Sheila
129,Marla wasn't distracting herself.,Marla wasn't distracting himself.,Marla wasn't distracting,herself,himself,morphology,anaphor_agreement,anaphor_gender_agreement,True,True,False,False,129,Marla,Marla
130,Dana hasn't respected herself.,Dana hasn't respected itself.,Dana hasn't respected,herself,itself,morphology,anaphor_agreement,anaphor_gender_agreement,True,True,False,False,130,Dana,Dana
131,Curtis isn't scaring himself.,Curtis isn't scaring herself.,Curtis isn't scaring,himself,herself,morphology,anaphor_agreement,anaphor_gender_agreement,True,True,False,False,131,Curtis,Curtis
132,Some organization had distracted itself.,Some organization had distracted himself.,Some organization had distracted,itself,himself,morphology,anaphor_agreement,anaphor_gender_agreement,True,True,False,False,132,organization,Some organization
133,Some dancer has visited herself.,Some dancer has visited himself.,Some dancer has visited,herself,himself,morphology,anaphor_agreement,anaphor_gender_agreement,True,True,False,False,133,dancer,Some dancer
134,Adam returned to himself.,Adam returned to itself.,Adam returned to,himself,itself,morphology,anaphor_agreement,anaphor_gender_agreement,True,True,False,False,134,Adam,Adam
