,sentence_good,sentence_bad,one_prefix_prefix,one_prefix_word_good,one_prefix_word_bad,field,linguistics_term,UID,simple_LM_method,one_prefix_method,two_prefix_method,lexically_identical,pairID,target
490,Every restaurant was explored by the teenagers.,Every restaurant was explored by the gate.,Every restaurant was explored by the,teenagers,gate,syntax,s-selection,animate_subject_passive,True,True,False,False,490,explored
491,That cup wasn't fixed by the doctors.,That cup wasn't fixed by the socks.,That cup wasn't fixed by the,doctors,socks,syntax,s-selection,animate_subject_passive,True,True,False,False,491,fixed
492,All restaurants weren't discussed by the senator.,All restaurants weren't discussed by the cucumbers.,All restaurants weren't discussed by the,senator,cucumbers,syntax,s-selection,animate_subject_passive,True,True,False,False,492,discussed
493,Elizabeth isn't disliked by some woman.,Elizabeth isn't disliked by some jacket.,Elizabeth isn't disliked by some,woman,jacket,syntax,s-selection,animate_subject_passive,True,True,False,False,493,disliked
494,Travis wasn't helped by the actresses.,Travis wasn't helped by the fish.,Travis wasn't helped by the,actresses,fish,syntax,s-selection,animate_subject_passive,True,True,False,False,494,helped
495,Every window isn't fixed by some men.,Every window isn't fixed by some car.,Every window isn't fixed by some,men,car,syntax,s-selection,animate_subject_passive,True,True,False,False,495,fixed
496,Most rivers were biked to by some guests.,Most rivers were biked to by some bicycle.,Most rivers were biked to by some,guests,bicycle,syntax,s-selection,animate_subject_passive,True,True,False,False,496,biked
497,A museum is exited by the waiters.,A museum is exited by the government.,A museum is exited by the,waiters,government,syntax,s-selection,animate_subject_passive,True,True,False,False,497,exited
498,These planes weren't thought about by some child.,These planes weren't thought about by some glove.,These planes weren't thought about by some,child,glove,syntax,s-selection,animate_subject_passive,True,True,False,False,498,thought
499,A man was healed by some men.,A man was healed by some octopus.,A man was healed by some,men,octopus,syntax,s-selection,animate_subject_passive,True,True,False,False,499,healed
500,Mitchell isn't fled from by the teachers.,Mitchell isn't fled from by the paralyses.,Mitchell isn't fled from by the,teachers,paralyses,syntax,s-selection,animate_subject_passive,True,True,False,False,500,fled
501,Malls aren't talked about by some teenager.,Malls aren't talked about by some dog.,Malls aren't talked about by some,teenager,dog,syntax,s-selection,animate_subject_passive,True,True,False,False,501,talked
502,Michael is remembered by some ladies.,Michael is remembered by some plane.,Michael is remembered by some,ladies,plane,syntax,s-selection,animate_subject_passive,True,True,False,False,502,remembered
503,Chad is remembered by the waiters.,Chad is remembered by the window.,Chad is remembered by the,waiters,window,syntax,s-selection,animate_subject_passive,True,True,False,False,503,remembered
504,Rhonda isn't hated by some adults.,Rhonda isn't hated by some box.,Rhonda isn't hated by some,adults,box,syntax,s-selection,animate_subject_passive,True,True,False,False,504,hated
505,That school was passed by some girls.,That school was passed by some skateboards.,That school was passed by some,girls,skateboards,syntax,s-selection,animate_subject_passive,True,True,False,False,505,passed
506,Melinda was talked about by the patients.,Melinda was talked about by the species.,Melinda was talked about by the,patients,species,syntax,s-selection,animate_subject_passive,True,True,False,False,506,talked
507,Some books aren't examined by some teachers.,Some books aren't examined by some brochure.,Some books aren't examined by some,teachers,brochure,syntax,s-selection,animate_subject_passive,True,True,False,False,507,examined
508,Some slope was climbed up by the guests.,Some slope was climbed up by the means.,Some slope was climbed up by the,guests,means,syntax,s-selection,animate_subject_passive,True,True,False,False,508,climbed
509,Julie wasn't admired by some children.,Julie wasn't admired by some trucks.,Julie wasn't admired by some,children,trucks,syntax,s-selection,animate_subject_passive,True,True,False,False,509,admired
510,This art gallery was driven to by some lady.,This art gallery was driven to by some eggplants.,This art gallery was driven to by some,lady,eggplants,syntax,s-selection,animate_subject_passive,True,True,False,False,510,driven
511,Spain wasn't walked through by some boy.,Spain wasn't walked through by some ladders.,Spain wasn't walked through by some,boy,ladders,syntax,s-selection,animate_subject_passive,True,True,False,False,511,walked
512,Angela was left by the guys.,Angela was left by the bicycle.,Angela was left by the,guys,bicycle,syntax,s-selection,animate_subject_passive,True,True,False,False,512,left
513,Emily was hired by some students.,Emily was hired by some diagnosis.,Emily was hired by some,students,diagnosis,syntax,s-selection,animate_subject_passive,True,True,False,False,513,hired
514,Every art gallery isn't explored by the actresses.,Every art gallery isn't explored by the mirrors.,Every art gallery isn't explored by the,actresses,mirrors,syntax,s-selection,animate_subject_passive,True,True,False,False,514,explored
515,Alicia was known by the waiters.,Alicia was known by the spotlight.,Alicia was known by the,waiters,spotlight,syntax,s-selection,animate_subject_passive,True,True,False,False,515,known
516,Many hills weren't climbed up by the waiter.,Many hills weren't climbed up by the crisis.,Many hills weren't climbed up by the,waiter,crisis,syntax,s-selection,animate_subject_passive,True,True,False,False,516,climbed
517,Those stairs were climbed up by some student.,Those stairs were climbed up by some syntheses.,Those stairs were climbed up by some,student,syntheses,syntax,s-selection,animate_subject_passive,True,True,False,False,517,climbed
518,A lot of waiters aren't praised by the offspring.,A lot of waiters aren't praised by the cilantro.,A lot of waiters aren't praised by the,offspring,cilantro,syntax,s-selection,animate_subject_passive,True,True,False,False,518,praised
519,Steven is cared for by some senator.,Steven is cared for by some story.,Steven is cared for by some,senator,story,syntax,s-selection,animate_subject_passive,True,True,False,False,519,cared
520,Some mall wasn't toured by the actresses.,Some mall wasn't toured by the screens.,Some mall wasn't toured by the,actresses,screens,syntax,s-selection,animate_subject_passive,True,True,False,False,520,toured
521,Cheryl wasn't cured by the teachers.,Cheryl wasn't cured by the snake.,Cheryl wasn't cured by the,teachers,snake,syntax,s-selection,animate_subject_passive,True,True,False,False,521,cured
522,This bicycle is fixed by the man.,This bicycle is fixed by the bananas.,This bicycle is fixed by the,man,bananas,syntax,s-selection,animate_subject_passive,True,True,False,False,522,fixed
523,A public park is biked to by the child.,A public park is biked to by the pasta.,A public park is biked to by the,child,pasta,syntax,s-selection,animate_subject_passive,True,True,False,False,523,biked
524,A bank wasn't biked to by some girl.,A bank wasn't biked to by some hats.,A bank wasn't biked to by some,girl,hats,syntax,s-selection,animate_subject_passive,True,True,False,False,524,biked
525,Margaret isn't loved by some children.,Margaret isn't loved by some book.,Margaret isn't loved by some,children,book,syntax,s-selection,animate_subject_passive,True,True,False,False,525,loved
526,A lot of mirrors weren't fixed by some guys.,A lot of mirrors weren't fixed by some birds.,A lot of mirrors weren't fixed by some,guys,birds,syntax,s-selection,animate_subject_passive,True,True,False,False,526,fixed
527,Every guest was healed by some doctor.,Every guest was healed by some species.,Every guest was healed by some,doctor,species,syntax,s-selection,animate_subject_passive,True,True,False,False,527,healed
528,Some museum was run around by the child.,Some museum was run around by the bikes.,Some museum was run around by the,child,bikes,syntax,s-selection,animate_subject_passive,True,True,False,False,528,run
529,Every cafe isn't passed by the waiters.,Every cafe isn't passed by the bread.,Every cafe isn't passed by the,waiters,bread,syntax,s-selection,animate_subject_passive,True,True,False,False,529,passed
530,A sketch is sold by the adults.,A sketch is sold by the skateboards.,A sketch is sold by the,adults,skateboards,syntax,s-selection,animate_subject_passive,True,True,False,False,530,sold
531,This hill isn't taken by some cashiers.,This hill isn't taken by some cacti.,This hill isn't taken by some,cashiers,cacti,syntax,s-selection,animate_subject_passive,True,True,False,False,531,taken
532,Laura is returned to by some offspring.,Laura is returned to by some bikes.,Laura is returned to by some,offspring,bikes,syntax,s-selection,animate_subject_passive,True,True,False,False,532,returned
533,Sandra was talked to by some actress.,Sandra was talked to by some geese.,Sandra was talked to by some,actress,geese,syntax,s-selection,animate_subject_passive,True,True,False,False,533,talked
534,Every high school isn't explored by the actress.,Every high school isn't explored by the spinach.,Every high school isn't explored by the,actress,spinach,syntax,s-selection,animate_subject_passive,True,True,False,False,534,explored
535,Every plane isn't broken by some customers.,Every plane isn't broken by some mouse.,Every plane isn't broken by some,customers,mouse,syntax,s-selection,animate_subject_passive,True,True,False,False,535,broken
536,Mark is talked to by some driver.,Mark is talked to by some dress.,Mark is talked to by some,driver,dress,syntax,s-selection,animate_subject_passive,True,True,False,False,536,talked
537,A lot of college campuses were skated around by the man.,A lot of college campuses were skated around by the screens.,A lot of college campuses were skated around by the,man,screens,syntax,s-selection,animate_subject_passive,True,True,False,False,537,skated
538,Judy is boasted about by the person.,Judy is boasted about by the carriage.,Judy is boasted about by the,person,carriage,syntax,s-selection,animate_subject_passive,True,True,False,False,538,boasted
539,Every movie was scanned by some guys.,Every movie was scanned by some window.,Every movie was scanned by some,guys,window,syntax,s-selection,animate_subject_passive,True,True,False,False,539,scanned
540,All planes are thought about by the doctors.,All planes are thought about by the computer.,All planes are thought about by the,doctors,computer,syntax,s-selection,animate_subject_passive,True,True,False,False,540,thought
541,All ladders aren't descended by the women.,All ladders aren't descended by the jacket.,All ladders aren't descended by the,women,jacket,syntax,s-selection,animate_subject_passive,True,True,False,False,541,descended
542,That truck wasn't thought about by some adults.,That truck wasn't thought about by some theses.,That truck wasn't thought about by some,adults,theses,syntax,s-selection,animate_subject_passive,True,True,False,False,542,thought
543,Most ladders aren't descended by the men.,Most ladders aren't descended by the couch.,Most ladders aren't descended by the,men,couch,syntax,s-selection,animate_subject_passive,True,True,False,False,543,descended
544,The bikes were seen by the waitresses.,The bikes were seen by the ice.,The bikes were seen by the,waitresses,ice,syntax,s-selection,animate_subject_passive,True,True,False,False,544,seen
545,Ella is appreciated by some alumni.,Ella is appreciated by some box.,Ella is appreciated by some,alumni,box,syntax,s-selection,animate_subject_passive,True,True,False,False,545,appreciated
546,A skateboard isn't brought by some woman.,A skateboard isn't brought by some fungus.,A skateboard isn't brought by some,woman,fungus,syntax,s-selection,animate_subject_passive,True,True,False,False,546,brought
547,A lot of skateboards aren't broken by some actress.,A lot of skateboards aren't broken by some association.,A lot of skateboards aren't broken by some,actress,association,syntax,s-selection,animate_subject_passive,True,True,False,False,547,broken
548,An art gallery wasn't exited by the children.,An art gallery wasn't exited by the movie.,An art gallery wasn't exited by the,children,movie,syntax,s-selection,animate_subject_passive,True,True,False,False,548,exited
549,All mountains were descended by some children.,All mountains were descended by some windows.,All mountains were descended by some,children,windows,syntax,s-selection,animate_subject_passive,True,True,False,False,549,descended
550,Richard is worked with by some actresses.,Richard is worked with by some couches.,Richard is worked with by some,actresses,couches,syntax,s-selection,animate_subject_passive,True,True,False,False,550,worked
551,Those high schools aren't walked through by some children.,Those high schools aren't walked through by some newspaper articles.,Those high schools aren't walked through by some,children,newspaper articles,syntax,s-selection,animate_subject_passive,True,True,False,False,551,walked
552,Holly wasn't visited by some doctors.,Holly wasn't visited by some steps.,Holly wasn't visited by some,doctors,steps,syntax,s-selection,animate_subject_passive,True,True,False,False,552,visited
553,These socks were worn by the student.,These socks were worn by the brochure.,These socks were worn by the,student,brochure,syntax,s-selection,animate_subject_passive,True,True,False,False,553,worn
554,Rodney is kissed by some actor.,Rodney is kissed by some cats.,Rodney is kissed by some,actor,cats,syntax,s-selection,animate_subject_passive,True,True,False,False,554,kissed
555,Angela is watched by some woman.,Angela is watched by some nuclei.,Angela is watched by some,woman,nuclei,syntax,s-selection,animate_subject_passive,True,True,False,False,555,watched
556,Mark is revealed by the guy.,Mark is revealed by the organization.,Mark is revealed by the,guy,organization,syntax,s-selection,animate_subject_passive,True,True,False,False,556,revealed
557,A report was scanned by the teenager.,A report was scanned by the light.,A report was scanned by the,teenager,light,syntax,s-selection,animate_subject_passive,True,True,False,False,557,scanned
558,Nina wasn't known by the ladies.,Nina wasn't known by the synthesis.,Nina wasn't known by the,ladies,synthesis,syntax,s-selection,animate_subject_passive,True,True,False,False,558,known
559,Tina was observed by the waitresses.,Tina was observed by the synopsis.,Tina was observed by the,waitresses,synopsis,syntax,s-selection,animate_subject_passive,True,True,False,False,559,observed
560,Those cakes are brought by some child.,Those cakes are brought by some unicycles.,Those cakes are brought by some,child,unicycles,syntax,s-selection,animate_subject_passive,True,True,False,False,560,brought
561,Some stories are discussed by some guys.,Some stories are discussed by some jacket.,Some stories are discussed by some,guys,jacket,syntax,s-selection,animate_subject_passive,True,True,False,False,561,discussed
562,Movie theaters were biked to by the waitress.,Movie theaters were biked to by the chair.,Movie theaters were biked to by the,waitress,chair,syntax,s-selection,animate_subject_passive,True,True,False,False,562,biked
563,A mall was skated around by some teenager.,A mall was skated around by some glasses.,A mall was skated around by some,teenager,glasses,syntax,s-selection,animate_subject_passive,True,True,False,False,563,skated
564,A hill is passed by some customers.,A hill is passed by some socks.,A hill is passed by some,customers,socks,syntax,s-selection,animate_subject_passive,True,True,False,False,564,passed
565,Every documentary isn't thought about by the pedestrians.,Every documentary isn't thought about by the icicles.,Every documentary isn't thought about by the,pedestrians,icicles,syntax,s-selection,animate_subject_passive,True,True,False,False,565,thought
566,That jacket was hidden by the child.,That jacket was hidden by the sketches.,That jacket was hidden by the,child,sketches,syntax,s-selection,animate_subject_passive,True,True,False,False,566,hidden
567,Jennifer is healed by some waiter.,Jennifer is healed by some truck.,Jennifer is healed by some,waiter,truck,syntax,s-selection,animate_subject_passive,True,True,False,False,567,healed
568,All lakes aren't talked about by the woman.,All lakes aren't talked about by the nucleus.,All lakes aren't talked about by the,woman,nucleus,syntax,s-selection,animate_subject_passive,True,True,False,False,568,talked
569,Some computer wasn't broken by some woman.,Some computer wasn't broken by some carriages.,Some computer wasn't broken by some,woman,carriages,syntax,s-selection,animate_subject_passive,True,True,False,False,569,broken
570,This book wasn't taken by some pedestrians.,This book wasn't taken by some glasses.,This book wasn't taken by some,pedestrians,glasses,syntax,s-selection,animate_subject_passive,True,True,False,False,570,taken
571,Jesus isn't researched by some adults.,Jesus isn't researched by some parentheses.,Jesus isn't researched by some,adults,parentheses,syntax,s-selection,animate_subject_passive,True,True,False,False,571,researched
572,The guest wasn't attacked by some people.,The guest wasn't attacked by some dogs.,The guest wasn't attacked by some,people,dogs,syntax,s-selection,animate_subject_passive,True,True,False,False,572,attacked
573,Maria was argued about by some customer.,Maria was argued about by some books.,Maria was argued about by some,customer,books,syntax,s-selection,animate_subject_passive,True,True,False,False,573,argued
574,All cafes aren't researched by the guys.,All cafes aren't researched by the nuclei.,All cafes aren't researched by the,guys,nuclei,syntax,s-selection,animate_subject_passive,True,True,False,False,574,researched
575,Laurie was disliked by the actresses.,Laurie was disliked by the screens.,Laurie was disliked by the,actresses,screens,syntax,s-selection,animate_subject_passive,True,True,False,False,575,disliked
576,Denise is concealed by the doctor.,Denise is concealed by the couch.,Denise is concealed by the,doctor,couch,syntax,s-selection,animate_subject_passive,True,True,False,False,576,concealed
577,Most grocery stores weren't cleaned by some drivers.,Most grocery stores weren't cleaned by some couch.,Most grocery stores weren't cleaned by some,drivers,couch,syntax,s-selection,animate_subject_passive,True,True,False,False,577,cleaned
578,Ellen isn't argued about by some adult.,Ellen isn't argued about by some carts.,Ellen isn't argued about by some,adult,carts,syntax,s-selection,animate_subject_passive,True,True,False,False,578,argued
579,Tracy was hugged by some children.,Tracy was hugged by some mirror.,Tracy was hugged by some,children,mirror,syntax,s-selection,animate_subject_passive,True,True,False,False,579,hugged
580,Catherine is disliked by the girls.,Catherine is disliked by the drawings.,Catherine is disliked by the,girls,drawings,syntax,s-selection,animate_subject_passive,True,True,False,False,580,disliked
581,William isn't helped by some actress.,William isn't helped by some couches.,William isn't helped by some,actress,couches,syntax,s-selection,animate_subject_passive,True,True,False,False,581,helped
582,That actress was hired by some driver.,That actress was hired by some prints.,That actress was hired by some,driver,prints,syntax,s-selection,animate_subject_passive,True,True,False,False,582,hired
583,Curtis was criticized by some guys.,Curtis was criticized by some plays.,Curtis was criticized by some,guys,plays,syntax,s-selection,animate_subject_passive,True,True,False,False,583,criticized
584,Dawn is approached by some girl.,Dawn is approached by some newspaper article.,Dawn is approached by some,girl,newspaper article,syntax,s-selection,animate_subject_passive,True,True,False,False,584,approached
585,All computers are fixed by some woman.,All computers are fixed by some computers.,All computers are fixed by some,woman,computers,syntax,s-selection,animate_subject_passive,True,True,False,False,585,fixed
586,Judy is praised by some actresses.,Judy is praised by some bikes.,Judy is praised by some,actresses,bikes,syntax,s-selection,animate_subject_passive,True,True,False,False,586,praised
587,Every movie theater isn't walked through by some senators.,Every movie theater isn't walked through by some casseroles.,Every movie theater isn't walked through by some,senators,casseroles,syntax,s-selection,animate_subject_passive,True,True,False,False,587,walked
588,John isn't remembered by some doctors.,John isn't remembered by some means.,John isn't remembered by some,doctors,means,syntax,s-selection,animate_subject_passive,True,True,False,False,588,remembered
589,A lot of hills aren't passed by the boy.,A lot of hills aren't passed by the carts.,A lot of hills aren't passed by the,boy,carts,syntax,s-selection,animate_subject_passive,True,True,False,False,589,passed
590,This shirt wasn't cleaned by the man.,This shirt wasn't cleaned by the means.,This shirt wasn't cleaned by the,man,means,syntax,s-selection,animate_subject_passive,True,True,False,False,590,cleaned
591,Many movies are examined by the waiters.,Many movies are examined by the axes.,Many movies are examined by the,waiters,axes,syntax,s-selection,animate_subject_passive,True,True,False,False,591,examined
592,Some documentary is examined by the woman.,Some documentary is examined by the stimuli.,Some documentary is examined by the,woman,stimuli,syntax,s-selection,animate_subject_passive,True,True,False,False,592,examined
593,The rice wasn't revealed by some ladies.,The rice wasn't revealed by some associations.,The rice wasn't revealed by some,ladies,associations,syntax,s-selection,animate_subject_passive,True,True,False,False,593,revealed
594,Heidi wasn't loved by the women.,Heidi wasn't loved by the parentheses.,Heidi wasn't loved by the,women,parentheses,syntax,s-selection,animate_subject_passive,True,True,False,False,594,loved
595,Monet is appreciated by the doctor.,Monet is appreciated by the muffins.,Monet is appreciated by the,doctor,muffins,syntax,s-selection,animate_subject_passive,True,True,False,False,595,appreciated
596,Gary wasn't concealed by the girl.,Gary wasn't concealed by the committees.,Gary wasn't concealed by the,girl,committees,syntax,s-selection,animate_subject_passive,True,True,False,False,596,concealed
597,Aaron is loved by the students.,Aaron is loved by the chairs.,Aaron is loved by the,students,chairs,syntax,s-selection,animate_subject_passive,True,True,False,False,597,loved
598,Many restaurants aren't walked through by the senators.,Many restaurants aren't walked through by the legislature.,Many restaurants aren't walked through by the,senators,legislature,syntax,s-selection,animate_subject_passive,True,True,False,False,598,walked
599,The bank isn't cleaned by some guest.,The bank isn't cleaned by some blouses.,The bank isn't cleaned by some,guest,blouses,syntax,s-selection,animate_subject_passive,True,True,False,False,599,cleaned
600,James wasn't revealed by some woman.,James wasn't revealed by some cars.,James wasn't revealed by some,woman,cars,syntax,s-selection,animate_subject_passive,True,True,False,False,600,revealed
601,This movie theater wasn't arrived at by the teacher.,This movie theater wasn't arrived at by the report.,This movie theater wasn't arrived at by the,teacher,report,syntax,s-selection,animate_subject_passive,True,True,False,False,601,arrived
602,Some rivers are dropped by by the child.,Some rivers are dropped by by the carriages.,Some rivers are dropped by by the,child,carriages,syntax,s-selection,animate_subject_passive,True,True,False,False,602,dropped
603,Wayne wasn't hidden by some drivers.,Wayne wasn't hidden by some sheep.,Wayne wasn't hidden by some,drivers,sheep,syntax,s-selection,animate_subject_passive,True,True,False,False,603,hidden
604,Becca wasn't criticized by the drivers.,Becca wasn't criticized by the thesis.,Becca wasn't criticized by the,drivers,thesis,syntax,s-selection,animate_subject_passive,True,True,False,False,604,criticized
605,Many socks weren't admired by some actors.,Many socks weren't admired by some analysis.,Many socks weren't admired by some,actors,analysis,syntax,s-selection,animate_subject_passive,True,True,False,False,605,admired
606,The reports weren't bought by the pedestrian.,The reports weren't bought by the convertibles.,The reports weren't bought by the,pedestrian,convertibles,syntax,s-selection,animate_subject_passive,True,True,False,False,606,bought
607,Judy isn't healed by some children.,Judy isn't healed by some candles.,Judy isn't healed by some,children,candles,syntax,s-selection,animate_subject_passive,True,True,False,False,607,healed
608,Alicia isn't loved by the teenagers.,Alicia isn't loved by the prints.,Alicia isn't loved by the,teenagers,prints,syntax,s-selection,animate_subject_passive,True,True,False,False,608,loved
609,This slope was climbed down by some guys.,This slope was climbed down by some cacti.,This slope was climbed down by some,guys,cacti,syntax,s-selection,animate_subject_passive,True,True,False,False,609,climbed
610,Many stories were examined by some doctor.,Many stories were examined by some ice.,Many stories were examined by some,doctor,ice,syntax,s-selection,animate_subject_passive,True,True,False,False,610,examined
611,Many dresses weren't cleaned by some woman.,Many dresses weren't cleaned by some boxes.,Many dresses weren't cleaned by some,woman,boxes,syntax,s-selection,animate_subject_passive,True,True,False,False,611,cleaned
612,This mouth was lifted by the men.,This mouth was lifted by the ladders.,This mouth was lifted by the,men,ladders,syntax,s-selection,animate_subject_passive,True,True,False,False,612,lifted
