,sentence_good,sentence_bad,one_prefix_prefix,one_prefix_word_good,one_prefix_word_bad,field,linguistics_term,UID,simple_LM_method,one_prefix_method,two_prefix_method,lexically_identical,pairID,target
734,Many public parks were run around by the teenager.,Many public parks were run around by the cat.,Many public parks were run around by the,teenager,cat,syntax,s-selection,animate_subject_passive,True,True,False,False,734,run
735,Kevin isn't hired by the guys.,Kevin isn't hired by the glass.,Kevin isn't hired by the,guys,glass,syntax,s-selection,animate_subject_passive,True,True,False,False,735,hired
736,The slope was descended by some boys.,The slope was descended by some planes.,The slope was descended by some,boys,planes,syntax,s-selection,animate_subject_passive,True,True,False,False,736,descended
737,The mushroom isn't bought by some men.,The mushroom isn't bought by some plane.,The mushroom isn't bought by some,men,plane,syntax,s-selection,animate_subject_passive,True,True,False,False,737,bought
738,Amelia is listened to by the woman.,Amelia is listened to by the newspaper articles.,Amelia is listened to by the,woman,newspaper articles,syntax,s-selection,animate_subject_passive,True,True,False,False,738,listened
739,Jerry isn't approached by the woman.,Jerry isn't approached by the banana.,Jerry isn't approached by the,woman,banana,syntax,s-selection,animate_subject_passive,True,True,False,False,739,approached
740,Steps are climbed down by the alumni.,Steps are climbed down by the rice.,Steps are climbed down by the,alumni,rice,syntax,s-selection,animate_subject_passive,True,True,False,False,740,climbed
741,Some schools weren't walked through by the teenager.,Some schools weren't walked through by the water.,Some schools weren't walked through by the,teenager,water,syntax,s-selection,animate_subject_passive,True,True,False,False,741,walked
742,Theodore isn't revealed by the girl.,Theodore isn't revealed by the glass.,Theodore isn't revealed by the,girl,glass,syntax,s-selection,animate_subject_passive,True,True,False,False,742,revealed
743,These people are observed by some alumnus.,These people are observed by some glove.,These people are observed by some,alumnus,glove,syntax,s-selection,animate_subject_passive,True,True,False,False,743,observed
744,The Borgias were sounded like by the guests.,The Borgias were sounded like by the glasses.,The Borgias were sounded like by the,guests,glasses,syntax,s-selection,animate_subject_passive,True,True,False,False,744,sounded
745,Some doors are taken by some dancer.,Some doors are taken by some mouth.,Some doors are taken by some,dancer,mouth,syntax,s-selection,animate_subject_passive,True,True,False,False,745,taken
746,Some bank is toured by the girl.,Some bank is toured by the gates.,Some bank is toured by the,girl,gates,syntax,s-selection,animate_subject_passive,True,True,False,False,746,toured
747,Some hill was descended by some guests.,Some hill was descended by some stories.,Some hill was descended by some,guests,stories,syntax,s-selection,animate_subject_passive,True,True,False,False,747,descended
748,Cynthia is discovered by some doctors.,Cynthia is discovered by some eggplants.,Cynthia is discovered by some,doctors,eggplants,syntax,s-selection,animate_subject_passive,True,True,False,False,748,discovered
749,The senator is cured by the students.,The senator is cured by the carriages.,The senator is cured by the,students,carriages,syntax,s-selection,animate_subject_passive,True,True,False,False,749,cured
750,A hill isn't climbed up by the actor.,A hill isn't climbed up by the plate.,A hill isn't climbed up by the,actor,plate,syntax,s-selection,animate_subject_passive,True,True,False,False,750,climbed
751,Those museums aren't biked to by the waiters.,Those museums aren't biked to by the pamphlets.,Those museums aren't biked to by the,waiters,pamphlets,syntax,s-selection,animate_subject_passive,True,True,False,False,751,biked
752,Tanya wasn't attacked by the patients.,Tanya wasn't attacked by the bike.,Tanya wasn't attacked by the,patients,bike,syntax,s-selection,animate_subject_passive,True,True,False,False,752,attacked
753,An art gallery was passed by some boys.,An art gallery was passed by some dishes.,An art gallery was passed by some,boys,dishes,syntax,s-selection,animate_subject_passive,True,True,False,False,753,passed
754,Eva was loved by some people.,Eva was loved by some light.,Eva was loved by some,people,light,syntax,s-selection,animate_subject_passive,True,True,False,False,754,loved
755,A closet is gone to by some man.,A closet is gone to by some sketches.,A closet is gone to by some,man,sketches,syntax,s-selection,animate_subject_passive,True,True,False,False,755,gone
756,Christina was hated by some teenager.,Christina was hated by some paralyses.,Christina was hated by some,teenager,paralyses,syntax,s-selection,animate_subject_passive,True,True,False,False,756,hated
757,All art galleries weren't passed by the lady.,All art galleries weren't passed by the paralyses.,All art galleries weren't passed by the,lady,paralyses,syntax,s-selection,animate_subject_passive,True,True,False,False,757,passed
758,The guest isn't escaped from by the senator.,The guest isn't escaped from by the stairs.,The guest isn't escaped from by the,senator,stairs,syntax,s-selection,animate_subject_passive,True,True,False,False,758,escaped
759,Those bikes are broken by some guest.,Those bikes are broken by some cake.,Those bikes are broken by some,guest,cake,syntax,s-selection,animate_subject_passive,True,True,False,False,759,broken
760,Many glaciers were explored by some alumnus.,Many glaciers were explored by some report.,Many glaciers were explored by some,alumnus,report,syntax,s-selection,animate_subject_passive,True,True,False,False,760,explored
761,Every mountain isn't run around by some dancer.,Every mountain isn't run around by some plate.,Every mountain isn't run around by some,dancer,plate,syntax,s-selection,animate_subject_passive,True,True,False,False,761,run
762,Many slopes were concealed by some actresses.,Many slopes were concealed by some light.,Many slopes were concealed by some,actresses,light,syntax,s-selection,animate_subject_passive,True,True,False,False,762,concealed
763,Rodney wasn't appreciated by the adults.,Rodney wasn't appreciated by the fungus.,Rodney wasn't appreciated by the,adults,fungus,syntax,s-selection,animate_subject_passive,True,True,False,False,763,appreciated
764,Some ice isn't lifted by some boy.,Some ice isn't lifted by some octopus.,Some ice isn't lifted by some,boy,octopus,syntax,s-selection,animate_subject_passive,True,True,False,False,764,lifted
765,The glaciers weren't arrived at by some doctors.,The glaciers weren't arrived at by some books.,The glaciers weren't arrived at by some,doctors,books,syntax,s-selection,animate_subject_passive,True,True,False,False,765,arrived
766,Chicken wasn't taken by some lady.,Chicken wasn't taken by some hamsters.,Chicken wasn't taken by some,lady,hamsters,syntax,s-selection,animate_subject_passive,True,True,False,False,766,taken
767,These guests aren't cured by some driver.,These guests aren't cured by some shoe.,These guests aren't cured by some,driver,shoe,syntax,s-selection,animate_subject_passive,True,True,False,False,767,cured
768,These libraries weren't cleaned by some waiter.,These libraries weren't cleaned by some lice.,These libraries weren't cleaned by some,waiter,lice,syntax,s-selection,animate_subject_passive,True,True,False,False,768,cleaned
769,That art gallery isn't visited by some actor.,That art gallery isn't visited by some shoes.,That art gallery isn't visited by some,actor,shoes,syntax,s-selection,animate_subject_passive,True,True,False,False,769,visited
770,That closet wasn't passed by some woman.,That closet wasn't passed by some goose.,That closet wasn't passed by some,woman,goose,syntax,s-selection,animate_subject_passive,True,True,False,False,770,passed
771,Some movies were examined by some actresses.,Some movies were examined by some louse.,Some movies were examined by some,actresses,louse,syntax,s-selection,animate_subject_passive,True,True,False,False,771,examined
772,Daniel isn't concealed by the teenagers.,Daniel isn't concealed by the bananas.,Daniel isn't concealed by the,teenagers,bananas,syntax,s-selection,animate_subject_passive,True,True,False,False,772,concealed
773,The fork is revealed by some dancer.,The fork is revealed by some geese.,The fork is revealed by some,dancer,geese,syntax,s-selection,animate_subject_passive,True,True,False,False,773,revealed
774,The prints aren't concealed by the woman.,The prints aren't concealed by the steak.,The prints aren't concealed by the,woman,steak,syntax,s-selection,animate_subject_passive,True,True,False,False,774,concealed
775,Robert isn't concealed by some patient.,Robert isn't concealed by some drawing.,Robert isn't concealed by some,patient,drawing,syntax,s-selection,animate_subject_passive,True,True,False,False,775,concealed
776,James wasn't escaped from by the women.,James wasn't escaped from by the cart.,James wasn't escaped from by the,women,cart,syntax,s-selection,animate_subject_passive,True,True,False,False,776,escaped
777,Most hills are driven to by some senators.,Most hills are driven to by some carriages.,Most hills are driven to by some,senators,carriages,syntax,s-selection,animate_subject_passive,True,True,False,False,777,driven
778,This dress is sold by some waitresses.,This dress is sold by some report.,This dress is sold by some,waitresses,report,syntax,s-selection,animate_subject_passive,True,True,False,False,778,sold
779,Many glasses were brought by the alumnus.,Many glasses were brought by the paintings.,Many glasses were brought by the,alumnus,paintings,syntax,s-selection,animate_subject_passive,True,True,False,False,779,brought
780,Douglas was fired by some driver.,Douglas was fired by some skateboards.,Douglas was fired by some,driver,skateboards,syntax,s-selection,animate_subject_passive,True,True,False,False,780,fired
781,Many slopes aren't climbed down by some waiters.,Many slopes aren't climbed down by some cakes.,Many slopes aren't climbed down by some,waiters,cakes,syntax,s-selection,animate_subject_passive,True,True,False,False,781,climbed
782,Beverly was criticized by some actresses.,Beverly was criticized by some synthesis.,Beverly was criticized by some,actresses,synthesis,syntax,s-selection,animate_subject_passive,True,True,False,False,782,criticized
783,Those public parks aren't skated around by the child.,Those public parks aren't skated around by the screens.,Those public parks aren't skated around by the,child,screens,syntax,s-selection,animate_subject_passive,True,True,False,False,783,skated
784,Most ladders weren't ascended by the alumnus.,Most ladders weren't ascended by the paintings.,Most ladders weren't ascended by the,alumnus,paintings,syntax,s-selection,animate_subject_passive,True,True,False,False,784,ascended
785,Candice isn't visited by the man.,Candice isn't visited by the vase.,Candice isn't visited by the,man,vase,syntax,s-selection,animate_subject_passive,True,True,False,False,785,visited
786,Alexander isn't attacked by some offspring.,Alexander isn't attacked by some horse.,Alexander isn't attacked by some,offspring,horse,syntax,s-selection,animate_subject_passive,True,True,False,False,786,attacked
787,A high school isn't messed up by the actresses.,A high school isn't messed up by the octopus.,A high school isn't messed up by the,actresses,octopus,syntax,s-selection,animate_subject_passive,True,True,False,False,787,messed
788,A dancer was fired by the adult.,A dancer was fired by the convertible.,A dancer was fired by the,adult,convertible,syntax,s-selection,animate_subject_passive,True,True,False,False,788,fired
789,Donna isn't escaped from by the woman.,Donna isn't escaped from by the ladder.,Donna isn't escaped from by the,woman,ladder,syntax,s-selection,animate_subject_passive,True,True,False,False,789,escaped
790,Bethany isn't disliked by some alumnus.,Bethany isn't disliked by some fish.,Bethany isn't disliked by some,alumnus,fish,syntax,s-selection,animate_subject_passive,True,True,False,False,790,disliked
791,These apples aren't found by some patients.,These apples aren't found by some commentary.,These apples aren't found by some,patients,commentary,syntax,s-selection,animate_subject_passive,True,True,False,False,791,found
792,That company is boycotted by some offspring.,That company is boycotted by some banana.,That company is boycotted by some,offspring,banana,syntax,s-selection,animate_subject_passive,True,True,False,False,792,boycotted
793,The socks are taken by some men.,The socks are taken by some jacket.,The socks are taken by some,men,jacket,syntax,s-selection,animate_subject_passive,True,True,False,False,793,taken
794,A slope is ascended by the guests.,A slope is ascended by the scarves.,A slope is ascended by the,guests,scarves,syntax,s-selection,animate_subject_passive,True,True,False,False,794,ascended
795,The restaurant was explored by the waitresses.,The restaurant was explored by the association.,The restaurant was explored by the,waitresses,association,syntax,s-selection,animate_subject_passive,True,True,False,False,795,explored
796,Randolf wasn't appreciated by some guy.,Randolf wasn't appreciated by some paralysis.,Randolf wasn't appreciated by some,guy,paralysis,syntax,s-selection,animate_subject_passive,True,True,False,False,796,appreciated
797,Laurie was appreciated by the drivers.,Laurie was appreciated by the report.,Laurie was appreciated by the,drivers,report,syntax,s-selection,animate_subject_passive,True,True,False,False,797,appreciated
798,Gary is listened to by some drivers.,Gary is listened to by some skateboard.,Gary is listened to by some,drivers,skateboard,syntax,s-selection,animate_subject_passive,True,True,False,False,798,listened
799,A lot of pictures weren't researched by some men.,A lot of pictures weren't researched by some nuclei.,A lot of pictures weren't researched by some,men,nuclei,syntax,s-selection,animate_subject_passive,True,True,False,False,799,researched
800,Suzanne is referenced by the senators.,Suzanne is referenced by the organization.,Suzanne is referenced by the,senators,organization,syntax,s-selection,animate_subject_passive,True,True,False,False,800,referenced
801,Cups aren't cleaned by the teachers.,Cups aren't cleaned by the foot.,Cups aren't cleaned by the,teachers,foot,syntax,s-selection,animate_subject_passive,True,True,False,False,801,cleaned
802,Most bikes weren't broken by some waitress.,Most bikes weren't broken by some projectors.,Most bikes weren't broken by some,waitress,projectors,syntax,s-selection,animate_subject_passive,True,True,False,False,802,broken
803,Many cafes were exited by some doctors.,Many cafes were exited by some screens.,Many cafes were exited by some,doctors,screens,syntax,s-selection,animate_subject_passive,True,True,False,False,803,exited
804,Benjamin isn't seen by some ladies.,Benjamin isn't seen by some mouth.,Benjamin isn't seen by some,ladies,mouth,syntax,s-selection,animate_subject_passive,True,True,False,False,804,seen
805,Veronica isn't questioned by the patient.,Veronica isn't questioned by the eyes.,Veronica isn't questioned by the,patient,eyes,syntax,s-selection,animate_subject_passive,True,True,False,False,805,questioned
806,That skirt wasn't worn by the ladies.,That skirt wasn't worn by the dog.,That skirt wasn't worn by the,ladies,dog,syntax,s-selection,animate_subject_passive,True,True,False,False,806,worn
807,Nancy isn't cared for by some woman.,Nancy isn't cared for by some hamster.,Nancy isn't cared for by some,woman,hamster,syntax,s-selection,animate_subject_passive,True,True,False,False,807,cared
808,Closets were admired by some girl.,Closets were admired by some banana.,Closets were admired by some,girl,banana,syntax,s-selection,animate_subject_passive,True,True,False,False,808,admired
809,A lot of customers were disliked by some person.,A lot of customers were disliked by some casseroles.,A lot of customers were disliked by some,person,casseroles,syntax,s-selection,animate_subject_passive,True,True,False,False,809,disliked
810,A lot of eggplants are lifted by some actress.,A lot of eggplants are lifted by some associations.,A lot of eggplants are lifted by some,actress,associations,syntax,s-selection,animate_subject_passive,True,True,False,False,810,lifted
811,Barbara wasn't worked with by some lady.,Barbara wasn't worked with by some shirt.,Barbara wasn't worked with by some,lady,shirt,syntax,s-selection,animate_subject_passive,True,True,False,False,811,worked
812,Melinda was hired by the guy.,Melinda was hired by the dogs.,Melinda was hired by the,guy,dogs,syntax,s-selection,animate_subject_passive,True,True,False,False,812,hired
813,These planes are broken by some students.,These planes are broken by some government.,These planes are broken by some,students,government,syntax,s-selection,animate_subject_passive,True,True,False,False,813,broken
814,Carrie was listened to by some cashier.,Carrie was listened to by some photographs.,Carrie was listened to by some,cashier,photographs,syntax,s-selection,animate_subject_passive,True,True,False,False,814,listened
815,All rivers were bought by some woman.,All rivers were bought by some vases.,All rivers were bought by some,woman,vases,syntax,s-selection,animate_subject_passive,True,True,False,False,815,bought
816,Those lakes were gone to by the pedestrians.,Those lakes were gone to by the plate.,Those lakes were gone to by the,pedestrians,plate,syntax,s-selection,animate_subject_passive,True,True,False,False,816,gone
817,A cart is discovered by the child.,A cart is discovered by the lice.,A cart is discovered by the,child,lice,syntax,s-selection,animate_subject_passive,True,True,False,False,817,discovered
818,Lori is attacked by some waiters.,Lori is attacked by some diagnosis.,Lori is attacked by some,waiters,diagnosis,syntax,s-selection,animate_subject_passive,True,True,False,False,818,attacked
819,This mall wasn't revealed by some lady.,This mall wasn't revealed by some pamphlets.,This mall wasn't revealed by some,lady,pamphlets,syntax,s-selection,animate_subject_passive,True,True,False,False,819,revealed
820,These stairs weren't ascended by some doctor.,These stairs weren't ascended by some bicycles.,These stairs weren't ascended by some,doctor,bicycles,syntax,s-selection,animate_subject_passive,True,True,False,False,820,ascended
821,The Great Lakes are toured by the actresses.,The Great Lakes are toured by the bananas.,The Great Lakes are toured by the,actresses,bananas,syntax,s-selection,animate_subject_passive,True,True,False,False,821,toured
822,Dana wasn't kissed by some teenager.,Dana wasn't kissed by some couches.,Dana wasn't kissed by some,teenager,couches,syntax,s-selection,animate_subject_passive,True,True,False,False,822,kissed
823,Many women are hugged by some pedestrian.,Many women are hugged by some unicycles.,Many women are hugged by some,pedestrian,unicycles,syntax,s-selection,animate_subject_passive,True,True,False,False,823,hugged
824,Some college campuses were skated around by the senators.,Some college campuses were skated around by the carriage.,Some college campuses were skated around by the,senators,carriage,syntax,s-selection,animate_subject_passive,True,True,False,False,824,skated
825,Elizabeth was discussed by the students.,Elizabeth was discussed by the hats.,Elizabeth was discussed by the,students,hats,syntax,s-selection,animate_subject_passive,True,True,False,False,825,discussed
826,A plane isn't fixed by some pedestrian.,A plane isn't fixed by some fish.,A plane isn't fixed by some,pedestrian,fish,syntax,s-selection,animate_subject_passive,True,True,False,False,826,fixed
827,Elizabeth was praised by the customer.,Elizabeth was praised by the hypotheses.,Elizabeth was praised by the,customer,hypotheses,syntax,s-selection,animate_subject_passive,True,True,False,False,827,praised
828,Carol is described by some senators.,Carol is described by some chicken.,Carol is described by some,senators,chicken,syntax,s-selection,animate_subject_passive,True,True,False,False,828,described
829,Cheryl isn't talked to by the boy.,Cheryl isn't talked to by the theses.,Cheryl isn't talked to by the,boy,theses,syntax,s-selection,animate_subject_passive,True,True,False,False,829,talked
830,Those slopes aren't climbed down by some students.,Those slopes aren't climbed down by some gates.,Those slopes aren't climbed down by some,students,gates,syntax,s-selection,animate_subject_passive,True,True,False,False,830,climbed
831,Liam is listened to by the teacher.,Liam is listened to by the paralyses.,Liam is listened to by the,teacher,paralyses,syntax,s-selection,animate_subject_passive,True,True,False,False,831,listened
832,Every unicycle is sold by the senator.,Every unicycle is sold by the report.,Every unicycle is sold by the,senator,report,syntax,s-selection,animate_subject_passive,True,True,False,False,832,sold
833,Most actresses aren't disliked by the waitresses.,Most actresses aren't disliked by the glass.,Most actresses aren't disliked by the,waitresses,glass,syntax,s-selection,animate_subject_passive,True,True,False,False,833,disliked
834,Every truck was broken by the cashier.,Every truck was broken by the diagnoses.,Every truck was broken by the,cashier,diagnoses,syntax,s-selection,animate_subject_passive,True,True,False,False,834,broken
835,That ladder was descended by the alumni.,That ladder was descended by the committee.,That ladder was descended by the,alumni,committee,syntax,s-selection,animate_subject_passive,True,True,False,False,835,descended
836,Timothy isn't discovered by the children.,Timothy isn't discovered by the pamphlet.,Timothy isn't discovered by the,children,pamphlet,syntax,s-selection,animate_subject_passive,True,True,False,False,836,discovered
837,Wendy wasn't approached by the actors.,Wendy wasn't approached by the eggplants.,Wendy wasn't approached by the,actors,eggplants,syntax,s-selection,animate_subject_passive,True,True,False,False,837,approached
838,Many plays were examined by the teachers.,Many plays were examined by the radii.,Many plays were examined by the,teachers,radii,syntax,s-selection,animate_subject_passive,True,True,False,False,838,examined
839,Some river isn't visited by some customers.,Some river isn't visited by some pasta.,Some river isn't visited by some,customers,pasta,syntax,s-selection,animate_subject_passive,True,True,False,False,839,visited
840,A lot of mouths were found by the teacher.,A lot of mouths were found by the plays.,A lot of mouths were found by the,teacher,plays,syntax,s-selection,animate_subject_passive,True,True,False,False,840,found
841,These cafes aren't run around by some cashier.,These cafes aren't run around by some birds.,These cafes aren't run around by some,cashier,birds,syntax,s-selection,animate_subject_passive,True,True,False,False,841,run
842,Glaciers are appreciated by the guys.,Glaciers are appreciated by the play.,Glaciers are appreciated by the,guys,play,syntax,s-selection,animate_subject_passive,True,True,False,False,842,appreciated
843,Carmen isn't left by some man.,Carmen isn't left by some lamp.,Carmen isn't left by some,man,lamp,syntax,s-selection,animate_subject_passive,True,True,False,False,843,left
844,Barbara isn't hated by the ladies.,Barbara isn't hated by the prints.,Barbara isn't hated by the,ladies,prints,syntax,s-selection,animate_subject_passive,True,True,False,False,844,hated
845,That car isn't sold by some offspring.,That car isn't sold by some governments.,That car isn't sold by some,offspring,governments,syntax,s-selection,animate_subject_passive,True,True,False,False,845,sold
846,The cafe was explored by the dancer.,The cafe was explored by the deer.,The cafe was explored by the,dancer,deer,syntax,s-selection,animate_subject_passive,True,True,False,False,846,explored
847,Most peppers weren't brought by some student.,Most peppers weren't brought by some screen.,Most peppers weren't brought by some,student,screen,syntax,s-selection,animate_subject_passive,True,True,False,False,847,brought
848,Debra was talked to by some children.,Debra was talked to by some turtle.,Debra was talked to by some,children,turtle,syntax,s-selection,animate_subject_passive,True,True,False,False,848,talked
849,Those glaciers weren't gone to by the senators.,Those glaciers weren't gone to by the fish.,Those glaciers weren't gone to by the,senators,fish,syntax,s-selection,animate_subject_passive,True,True,False,False,849,gone
850,Candice isn't hired by the woman.,Candice isn't hired by the fish.,Candice isn't hired by the,woman,fish,syntax,s-selection,animate_subject_passive,True,True,False,False,850,hired
851,The cafes aren't toured by some woman.,The cafes aren't toured by some computers.,The cafes aren't toured by some,woman,computers,syntax,s-selection,animate_subject_passive,True,True,False,False,851,toured
852,The plate wasn't broken by some pedestrian.,The plate wasn't broken by some deer.,The plate wasn't broken by some,pedestrian,deer,syntax,s-selection,animate_subject_passive,True,True,False,False,852,broken
853,Grace isn't admired by some men.,Grace isn't admired by some shawl.,Grace isn't admired by some,men,shawl,syntax,s-selection,animate_subject_passive,True,True,False,False,853,admired
854,The library isn't exited by the child.,The library isn't exited by the icicles.,The library isn't exited by the,child,icicles,syntax,s-selection,animate_subject_passive,True,True,False,False,854,exited
855,The river isn't boycotted by some driver.,The river isn't boycotted by some lights.,The river isn't boycotted by some,driver,lights,syntax,s-selection,animate_subject_passive,True,True,False,False,855,boycotted
