,sentence_good,sentence_bad,one_prefix_prefix,one_prefix_word_good,one_prefix_word_bad,field,linguistics_term,UID,simple_LM_method,one_prefix_method,two_prefix_method,lexically_identical,pairID,target
560,Even Janet really descended a mountain.,Even Janet ever descended a mountain.,Even Janet,really,ever,semantics,npi_licensing,npi_present_1,True,True,False,False,560,Even
561,Even the senators can really know Veronica.,Even the senators can ever know Veronica.,Even the senators can,really,ever,semantics,npi_licensing,npi_present_1,True,True,False,False,561,Even
562,Even Eric will really describe this story.,Even Eric will ever describe this story.,Even Eric will,really,ever,semantics,npi_licensing,npi_present_1,True,True,False,False,562,Even
563,Even Jill did also lie.,Even Jill did ever lie.,Even Jill did,also,ever,semantics,npi_licensing,npi_present_1,True,True,False,False,563,Even
564,Even this lamp often annoys Todd.,Even this lamp ever annoys Todd.,Even this lamp,often,ever,semantics,npi_licensing,npi_present_1,True,True,False,False,564,Even
565,Even Marcus also woke up.,Even Marcus ever woke up.,Even Marcus,also,ever,semantics,npi_licensing,npi_present_1,True,True,False,False,565,Even
566,Even Daniel had clearly gotten fired.,Even Daniel had ever gotten fired.,Even Daniel had,clearly,ever,semantics,npi_licensing,npi_present_1,True,True,False,False,566,Even
567,Even most bikes did often roll.,Even most bikes did ever roll.,Even most bikes did,often,ever,semantics,npi_licensing,npi_present_1,True,True,False,False,567,Even
568,Even Frank clearly prevented a lot of cashiers from nodding.,Even Frank ever prevented a lot of cashiers from nodding.,Even Frank,clearly,ever,semantics,npi_licensing,npi_present_1,True,True,False,False,568,Even
569,Even every lamp often dimmed.,Even every lamp ever dimmed.,Even every lamp,often,ever,semantics,npi_licensing,npi_present_1,True,True,False,False,569,Even
570,Even the blouses had clearly folded.,Even the blouses had ever folded.,Even the blouses had,clearly,ever,semantics,npi_licensing,npi_present_1,True,True,False,False,570,Even
571,Even Elaine had really ascended this slope.,Even Elaine had ever ascended this slope.,Even Elaine had,really,ever,semantics,npi_licensing,npi_present_1,True,True,False,False,571,Even
572,Even Tracy also worries.,Even Tracy ever worries.,Even Tracy,also,ever,semantics,npi_licensing,npi_present_1,True,True,False,False,572,Even
573,Even some screen also brightens.,Even some screen ever brightens.,Even some screen,also,ever,semantics,npi_licensing,npi_present_1,True,True,False,False,573,Even
574,Even every museum should certainly meet.,Even every museum should ever meet.,Even every museum should,certainly,ever,semantics,npi_licensing,npi_present_1,True,True,False,False,574,Even
575,Even Nicole certainly slumped over.,Even Nicole ever slumped over.,Even Nicole,certainly,ever,semantics,npi_licensing,npi_present_1,True,True,False,False,575,Even
576,Even Holly did clearly talk to Joseph.,Even Holly did ever talk to Joseph.,Even Holly did,clearly,ever,semantics,npi_licensing,npi_present_1,True,True,False,False,576,Even
577,Even most libraries really conspired.,Even most libraries ever conspired.,Even most libraries,really,ever,semantics,npi_licensing,npi_present_1,True,True,False,False,577,Even
578,Even all pedestrians also stand up.,Even all pedestrians ever stand up.,Even all pedestrians,also,ever,semantics,npi_licensing,npi_present_1,True,True,False,False,578,Even
579,Even Marcus clearly sways Jill to exercise.,Even Marcus ever sways Jill to exercise.,Even Marcus,clearly,ever,semantics,npi_licensing,npi_present_1,True,True,False,False,579,Even
580,Even Victoria could often fall asleep.,Even Victoria could ever fall asleep.,Even Victoria could,often,ever,semantics,npi_licensing,npi_present_1,True,True,False,False,580,Even
581,Even Renee certainly sneezed.,Even Renee ever sneezed.,Even Renee,certainly,ever,semantics,npi_licensing,npi_present_1,True,True,False,False,581,Even
582,Even this tomato will clearly rot.,Even this tomato will ever rot.,Even this tomato will,clearly,ever,semantics,npi_licensing,npi_present_1,True,True,False,False,582,Even
583,Even Guy certainly murmured.,Even Guy ever murmured.,Even Guy,certainly,ever,semantics,npi_licensing,npi_present_1,True,True,False,False,583,Even
584,Even peppers should clearly grow.,Even peppers should ever grow.,Even peppers should,clearly,ever,semantics,npi_licensing,npi_present_1,True,True,False,False,584,Even
585,Even many carts also crack.,Even many carts ever crack.,Even many carts,also,ever,semantics,npi_licensing,npi_present_1,True,True,False,False,585,Even
586,Even Amanda had certainly escaped.,Even Amanda had ever escaped.,Even Amanda had,certainly,ever,semantics,npi_licensing,npi_present_1,True,True,False,False,586,Even
587,Even all trucks also crash.,Even all trucks ever crash.,Even all trucks,also,ever,semantics,npi_licensing,npi_present_1,True,True,False,False,587,Even
588,Even Richard will clearly ask many actresses to irritate Diana.,Even Richard will ever ask many actresses to irritate Diana.,Even Richard will,clearly,ever,semantics,npi_licensing,npi_present_1,True,True,False,False,588,Even
589,Even these pedestrians really dated.,Even these pedestrians ever dated.,Even these pedestrians,really,ever,semantics,npi_licensing,npi_present_1,True,True,False,False,589,Even
590,Even Jerry really compromised.,Even Jerry ever compromised.,Even Jerry,really,ever,semantics,npi_licensing,npi_present_1,True,True,False,False,590,Even
591,Even those women clearly succeed.,Even those women ever succeed.,Even those women,clearly,ever,semantics,npi_licensing,npi_present_1,True,True,False,False,591,Even
592,Even those patients have certainly departed.,Even those patients have ever departed.,Even those patients have,certainly,ever,semantics,npi_licensing,npi_present_1,True,True,False,False,592,Even
593,Even the girl really performs.,Even the girl ever performs.,Even the girl,really,ever,semantics,npi_licensing,npi_present_1,True,True,False,False,593,Even
594,Even Michael often scratched.,Even Michael ever scratched.,Even Michael,often,ever,semantics,npi_licensing,npi_present_1,True,True,False,False,594,Even
595,Even some guests really perform.,Even some guests ever perform.,Even some guests,really,ever,semantics,npi_licensing,npi_present_1,True,True,False,False,595,Even
596,Even women often arrive at Spain.,Even women ever arrive at Spain.,Even women,often,ever,semantics,npi_licensing,npi_present_1,True,True,False,False,596,Even
597,Even Pamela has really gotten fired.,Even Pamela has ever gotten fired.,Even Pamela has,really,ever,semantics,npi_licensing,npi_present_1,True,True,False,False,597,Even
598,Even these committees have clearly considered Christopher to talk to this actress.,Even these committees have ever considered Christopher to talk to this actress.,Even these committees have,clearly,ever,semantics,npi_licensing,npi_present_1,True,True,False,False,598,Even
599,Even Monet really pressures Aaron to break some dishes.,Even Monet ever pressures Aaron to break some dishes.,Even Monet,really,ever,semantics,npi_licensing,npi_present_1,True,True,False,False,599,Even
600,Even these pictures clearly look like Eric.,Even these pictures ever look like Eric.,Even these pictures,clearly,ever,semantics,npi_licensing,npi_present_1,True,True,False,False,600,Even
601,Even all museums also dislike a lot of pedestrians.,Even all museums ever dislike a lot of pedestrians.,Even all museums,also,ever,semantics,npi_licensing,npi_present_1,True,True,False,False,601,Even
602,Even Sarah should clearly talk about Wayne.,Even Sarah should ever talk about Wayne.,Even Sarah should,clearly,ever,semantics,npi_licensing,npi_present_1,True,True,False,False,602,Even
603,Even these candles also darkened.,Even these candles ever darkened.,Even these candles,also,ever,semantics,npi_licensing,npi_present_1,True,True,False,False,603,Even
604,Even Steven will clearly chuckle.,Even Steven will ever chuckle.,Even Steven will,clearly,ever,semantics,npi_licensing,npi_present_1,True,True,False,False,604,Even
605,Even Sandra had certainly fled from Carla.,Even Sandra had ever fled from Carla.,Even Sandra had,certainly,ever,semantics,npi_licensing,npi_present_1,True,True,False,False,605,Even
606,Even these hats can often fold.,Even these hats can ever fold.,Even these hats can,often,ever,semantics,npi_licensing,npi_present_1,True,True,False,False,606,Even
607,Even every truck has really slipped.,Even every truck has ever slipped.,Even every truck has,really,ever,semantics,npi_licensing,npi_present_1,True,True,False,False,607,Even
608,Even Nancy might really clean libraries.,Even Nancy might ever clean libraries.,Even Nancy might,really,ever,semantics,npi_licensing,npi_present_1,True,True,False,False,608,Even
609,Even those senators often salute.,Even those senators ever salute.,Even those senators,often,ever,semantics,npi_licensing,npi_present_1,True,True,False,False,609,Even
610,Even some organization has really met.,Even some organization has ever met.,Even some organization has,really,ever,semantics,npi_licensing,npi_present_1,True,True,False,False,610,Even
611,Even some legislatures had also cooperated.,Even some legislatures had ever cooperated.,Even some legislatures had,also,ever,semantics,npi_licensing,npi_present_1,True,True,False,False,611,Even
612,Even some wheelbarrows also fell apart.,Even some wheelbarrows ever fell apart.,Even some wheelbarrows,also,ever,semantics,npi_licensing,npi_present_1,True,True,False,False,612,Even
613,Even ice would often vaporize.,Even ice would ever vaporize.,Even ice would,often,ever,semantics,npi_licensing,npi_present_1,True,True,False,False,613,Even
614,Even Wendy also convinces some associations to profit.,Even Wendy ever convinces some associations to profit.,Even Wendy,also,ever,semantics,npi_licensing,npi_present_1,True,True,False,False,614,Even
615,Even all guys often joke around.,Even all guys ever joke around.,Even all guys,often,ever,semantics,npi_licensing,npi_present_1,True,True,False,False,615,Even
616,Even Elizabeth has really realized who have hidden.,Even Elizabeth has ever realized who have hidden.,Even Elizabeth has,really,ever,semantics,npi_licensing,npi_present_1,True,True,False,False,616,Even
617,Even Diane has certainly complained.,Even Diane has ever complained.,Even Diane has,certainly,ever,semantics,npi_licensing,npi_present_1,True,True,False,False,617,Even
618,Even some cars have often slipped.,Even some cars have ever slipped.,Even some cars have,often,ever,semantics,npi_licensing,npi_present_1,True,True,False,False,618,Even
619,Even some students do clearly struggle.,Even some students do ever struggle.,Even some students do,clearly,ever,semantics,npi_licensing,npi_present_1,True,True,False,False,619,Even
620,Even Stephanie often finds that convertible.,Even Stephanie ever finds that convertible.,Even Stephanie,often,ever,semantics,npi_licensing,npi_present_1,True,True,False,False,620,Even
621,Even Winston Churchill clearly passes museums.,Even Winston Churchill ever passes museums.,Even Winston Churchill,clearly,ever,semantics,npi_licensing,npi_present_1,True,True,False,False,621,Even
622,Even the plane certainly chips.,Even the plane ever chips.,Even the plane,certainly,ever,semantics,npi_licensing,npi_present_1,True,True,False,False,622,Even
623,Even Rodney might often propose to have this ice cream.,Even Rodney might ever propose to have this ice cream.,Even Rodney might,often,ever,semantics,npi_licensing,npi_present_1,True,True,False,False,623,Even
624,Even John also badgered Bethany to boycott some government.,Even John ever badgered Bethany to boycott some government.,Even John,also,ever,semantics,npi_licensing,npi_present_1,True,True,False,False,624,Even
625,Even all doors have often embarrassed Janice.,Even all doors have ever embarrassed Janice.,Even all doors have,often,ever,semantics,npi_licensing,npi_present_1,True,True,False,False,625,Even
626,Even Pamela clearly imagines a lot of guys perform.,Even Pamela ever imagines a lot of guys perform.,Even Pamela,clearly,ever,semantics,npi_licensing,npi_present_1,True,True,False,False,626,Even
627,Even Colleen often falls.,Even Colleen ever falls.,Even Colleen,often,ever,semantics,npi_licensing,npi_present_1,True,True,False,False,627,Even
628,Even Peter should also pass every bank.,Even Peter should ever pass every bank.,Even Peter should,also,ever,semantics,npi_licensing,npi_present_1,True,True,False,False,628,Even
629,Even those actors certainly appreciate Ellen.,Even those actors ever appreciate Ellen.,Even those actors,certainly,ever,semantics,npi_licensing,npi_present_1,True,True,False,False,629,Even
630,Even Douglas often protests.,Even Douglas ever protests.,Even Douglas,often,ever,semantics,npi_licensing,npi_present_1,True,True,False,False,630,Even
631,Even the organizations often shock Helen.,Even the organizations ever shock Helen.,Even the organizations,often,ever,semantics,npi_licensing,npi_present_1,True,True,False,False,631,Even
632,Even many actresses will also fight.,Even many actresses will ever fight.,Even many actresses will,also,ever,semantics,npi_licensing,npi_present_1,True,True,False,False,632,Even
633,Even Kendra certainly wants to clean the bank.,Even Kendra ever wants to clean the bank.,Even Kendra,certainly,ever,semantics,npi_licensing,npi_present_1,True,True,False,False,633,Even
634,Even that pork often charred.,Even that pork ever charred.,Even that pork,often,ever,semantics,npi_licensing,npi_present_1,True,True,False,False,634,Even
635,Even every unicycle clearly falls apart.,Even every unicycle ever falls apart.,Even every unicycle,clearly,ever,semantics,npi_licensing,npi_present_1,True,True,False,False,635,Even
636,Even Rebecca does certainly kiss Deborah.,Even Rebecca does ever kiss Deborah.,Even Rebecca does,certainly,ever,semantics,npi_licensing,npi_present_1,True,True,False,False,636,Even
637,Even Helen could certainly approach Judy.,Even Helen could ever approach Judy.,Even Helen could,certainly,ever,semantics,npi_licensing,npi_present_1,True,True,False,False,637,Even
638,Even the students also hunt.,Even the students ever hunt.,Even the students,also,ever,semantics,npi_licensing,npi_present_1,True,True,False,False,638,Even
639,Even a lake might often condense.,Even a lake might ever condense.,Even a lake might,often,ever,semantics,npi_licensing,npi_present_1,True,True,False,False,639,Even
640,Even Russell had certainly laughed.,Even Russell had ever laughed.,Even Russell had,certainly,ever,semantics,npi_licensing,npi_present_1,True,True,False,False,640,Even
641,Even doctors really press the Clintons to cry.,Even doctors ever press the Clintons to cry.,Even doctors,really,ever,semantics,npi_licensing,npi_present_1,True,True,False,False,641,Even
642,Even most movie theaters often wasted away.,Even most movie theaters ever wasted away.,Even most movie theaters,often,ever,semantics,npi_licensing,npi_present_1,True,True,False,False,642,Even
643,Even every blouse can certainly fold.,Even every blouse can ever fold.,Even every blouse can,certainly,ever,semantics,npi_licensing,npi_present_1,True,True,False,False,643,Even
644,Even Dan also wanted every association to benefit.,Even Dan ever wanted every association to benefit.,Even Dan,also,ever,semantics,npi_licensing,npi_present_1,True,True,False,False,644,Even
645,Even Stephen often waved.,Even Stephen ever waved.,Even Stephen,often,ever,semantics,npi_licensing,npi_present_1,True,True,False,False,645,Even
646,Even Charles certainly concurs.,Even Charles ever concurs.,Even Charles,certainly,ever,semantics,npi_licensing,npi_present_1,True,True,False,False,646,Even
647,Even Susan can really argue about Derek.,Even Susan can ever argue about Derek.,Even Susan can,really,ever,semantics,npi_licensing,npi_present_1,True,True,False,False,647,Even
648,Even Cindy would really fall asleep.,Even Cindy would ever fall asleep.,Even Cindy would,really,ever,semantics,npi_licensing,npi_present_1,True,True,False,False,648,Even
649,Even these skateboards certainly steer.,Even these skateboards ever steer.,Even these skateboards,certainly,ever,semantics,npi_licensing,npi_present_1,True,True,False,False,649,Even
650,Even Aaron will clearly telephone.,Even Aaron will ever telephone.,Even Aaron will,clearly,ever,semantics,npi_licensing,npi_present_1,True,True,False,False,650,Even
651,Even Suzanne could clearly come here.,Even Suzanne could ever come here.,Even Suzanne could,clearly,ever,semantics,npi_licensing,npi_present_1,True,True,False,False,651,Even
652,Even Dawn has certainly broken every chair.,Even Dawn has ever broken every chair.,Even Dawn has,certainly,ever,semantics,npi_licensing,npi_present_1,True,True,False,False,652,Even
653,Even some apples also burn.,Even some apples ever burn.,Even some apples,also,ever,semantics,npi_licensing,npi_present_1,True,True,False,False,653,Even
654,Even these prints have also looked like every bird.,Even these prints have ever looked like every bird.,Even these prints have,also,ever,semantics,npi_licensing,npi_present_1,True,True,False,False,654,Even
655,Even the Impressionists will certainly flirt.,Even the Impressionists will ever flirt.,Even the Impressionists will,certainly,ever,semantics,npi_licensing,npi_present_1,True,True,False,False,655,Even
656,Even the boys certainly bother to yell.,Even the boys ever bother to yell.,Even the boys,certainly,ever,semantics,npi_licensing,npi_present_1,True,True,False,False,656,Even
657,Even Peter should often sway legislatures to work hard.,Even Peter should ever sway legislatures to work hard.,Even Peter should,often,ever,semantics,npi_licensing,npi_present_1,True,True,False,False,657,Even
658,Even that man had clearly sounded like Carmen.,Even that man had ever sounded like Carmen.,Even that man had,clearly,ever,semantics,npi_licensing,npi_present_1,True,True,False,False,658,Even
659,Even Sharon should really expect Tiffany to exercise.,Even Sharon should ever expect Tiffany to exercise.,Even Sharon should,really,ever,semantics,npi_licensing,npi_present_1,True,True,False,False,659,Even
660,Even the Clintons often divorced.,Even the Clintons ever divorced.,Even the Clintons,often,ever,semantics,npi_licensing,npi_present_1,True,True,False,False,660,Even
661,Even a sock clearly embarrassed Jesus.,Even a sock ever embarrassed Jesus.,Even a sock,clearly,ever,semantics,npi_licensing,npi_present_1,True,True,False,False,661,Even
662,Even Mark had really hoped to love Sonia.,Even Mark had ever hoped to love Sonia.,Even Mark had,really,ever,semantics,npi_licensing,npi_present_1,True,True,False,False,662,Even
663,Even politics really irritated Stacy.,Even politics ever irritated Stacy.,Even politics,really,ever,semantics,npi_licensing,npi_present_1,True,True,False,False,663,Even
664,Even Cindy also passed some restaurants.,Even Cindy ever passed some restaurants.,Even Cindy,also,ever,semantics,npi_licensing,npi_present_1,True,True,False,False,664,Even
665,Even these pedestrians also complained.,Even these pedestrians ever complained.,Even these pedestrians,also,ever,semantics,npi_licensing,npi_present_1,True,True,False,False,665,Even
666,Even those boxes have really flung open.,Even those boxes have ever flung open.,Even those boxes have,really,ever,semantics,npi_licensing,npi_present_1,True,True,False,False,666,Even
667,Even James also breaks some computer.,Even James ever breaks some computer.,Even James,also,ever,semantics,npi_licensing,npi_present_1,True,True,False,False,667,Even
668,Even Wendy might really prevent Robert from describing Diana.,Even Wendy might ever prevent Robert from describing Diana.,Even Wendy might,really,ever,semantics,npi_licensing,npi_present_1,True,True,False,False,668,Even
669,Even Phillip often believed these ladies to scratch.,Even Phillip ever believed these ladies to scratch.,Even Phillip,often,ever,semantics,npi_licensing,npi_present_1,True,True,False,False,669,Even
670,Even Winston Churchill might often embarrass Pamela.,Even Winston Churchill might ever embarrass Pamela.,Even Winston Churchill might,often,ever,semantics,npi_licensing,npi_present_1,True,True,False,False,670,Even
671,Even Kendra has clearly imagined most mushrooms had charred.,Even Kendra has ever imagined most mushrooms had charred.,Even Kendra has,clearly,ever,semantics,npi_licensing,npi_present_1,True,True,False,False,671,Even
672,Even Vanessa would also win.,Even Vanessa would ever win.,Even Vanessa would,also,ever,semantics,npi_licensing,npi_present_1,True,True,False,False,672,Even
673,Even Sara often likes some muffins.,Even Sara ever likes some muffins.,Even Sara,often,ever,semantics,npi_licensing,npi_present_1,True,True,False,False,673,Even
674,Even Vincent also declared Charles to remember Meredith.,Even Vincent ever declared Charles to remember Meredith.,Even Vincent,also,ever,semantics,npi_licensing,npi_present_1,True,True,False,False,674,Even
675,Even Regina had often fallen.,Even Regina had ever fallen.,Even Regina had,often,ever,semantics,npi_licensing,npi_present_1,True,True,False,False,675,Even
676,Even those adults have certainly kissed.,Even those adults have ever kissed.,Even those adults have,certainly,ever,semantics,npi_licensing,npi_present_1,True,True,False,False,676,Even
677,Even every shirt might also tighten.,Even every shirt might ever tighten.,Even every shirt might,also,ever,semantics,npi_licensing,npi_present_1,True,True,False,False,677,Even
678,Even James also stunned that lady.,Even James ever stunned that lady.,Even James,also,ever,semantics,npi_licensing,npi_present_1,True,True,False,False,678,Even
679,Even every organization has clearly conferred.,Even every organization has ever conferred.,Even every organization has,clearly,ever,semantics,npi_licensing,npi_present_1,True,True,False,False,679,Even
680,Even Catherine had really sighed.,Even Catherine had ever sighed.,Even Catherine had,really,ever,semantics,npi_licensing,npi_present_1,True,True,False,False,680,Even
681,Even Rodney clearly wore the socks.,Even Rodney ever wore the socks.,Even Rodney,clearly,ever,semantics,npi_licensing,npi_present_1,True,True,False,False,681,Even
682,Even Allison did often eat.,Even Allison did ever eat.,Even Allison did,often,ever,semantics,npi_licensing,npi_present_1,True,True,False,False,682,Even
683,Even these sweaters clearly frayed.,Even these sweaters ever frayed.,Even these sweaters,clearly,ever,semantics,npi_licensing,npi_present_1,True,True,False,False,683,Even
684,Even most actors might also happen to aggravate some organizations.,Even most actors might ever happen to aggravate some organizations.,Even most actors might,also,ever,semantics,npi_licensing,npi_present_1,True,True,False,False,684,Even
685,Even the government had clearly conferred.,Even the government had ever conferred.,Even the government had,clearly,ever,semantics,npi_licensing,npi_present_1,True,True,False,False,685,Even
686,Even those shirts really unfold.,Even those shirts ever unfold.,Even those shirts,really,ever,semantics,npi_licensing,npi_present_1,True,True,False,False,686,Even
687,Even those shawls often soak.,Even those shawls ever soak.,Even those shawls,often,ever,semantics,npi_licensing,npi_present_1,True,True,False,False,687,Even
688,Even Allison certainly fixed all trucks.,Even Allison ever fixed all trucks.,Even Allison,certainly,ever,semantics,npi_licensing,npi_present_1,True,True,False,False,688,Even
689,Even every guy certainly pushes that guy to fall asleep.,Even every guy ever pushes that guy to fall asleep.,Even every guy,certainly,ever,semantics,npi_licensing,npi_present_1,True,True,False,False,689,Even
690,Even Raymond also conceals some adult.,Even Raymond ever conceals some adult.,Even Raymond,also,ever,semantics,npi_licensing,npi_present_1,True,True,False,False,690,Even
691,Even Russell will clearly scratch.,Even Russell will ever scratch.,Even Russell will,clearly,ever,semantics,npi_licensing,npi_present_1,True,True,False,False,691,Even
692,Even a lot of guests will also exit Harvard University.,Even a lot of guests will ever exit Harvard University.,Even a lot of guests will,also,ever,semantics,npi_licensing,npi_present_1,True,True,False,False,692,Even
693,Even these schools certainly succeeded.,Even these schools ever succeeded.,Even these schools,certainly,ever,semantics,npi_licensing,npi_present_1,True,True,False,False,693,Even
694,Even Timothy often heals Douglas.,Even Timothy ever heals Douglas.,Even Timothy,often,ever,semantics,npi_licensing,npi_present_1,True,True,False,False,694,Even
695,Even Walter should also observe Charles.,Even Walter should ever observe Charles.,Even Walter should,also,ever,semantics,npi_licensing,npi_present_1,True,True,False,False,695,Even
696,Even Candice does certainly cough.,Even Candice does ever cough.,Even Candice does,certainly,ever,semantics,npi_licensing,npi_present_1,True,True,False,False,696,Even
697,Even some patients have clearly walked through every high school.,Even some patients have ever walked through every high school.,Even some patients have,clearly,ever,semantics,npi_licensing,npi_present_1,True,True,False,False,697,Even
698,Even those teachers also flirt.,Even those teachers ever flirt.,Even those teachers,also,ever,semantics,npi_licensing,npi_present_1,True,True,False,False,698,Even
699,Even all lights had often darkened.,Even all lights had ever darkened.,Even all lights had,often,ever,semantics,npi_licensing,npi_present_1,True,True,False,False,699,Even
700,Even Linda had often hidden Randolf.,Even Linda had ever hidden Randolf.,Even Linda had,often,ever,semantics,npi_licensing,npi_present_1,True,True,False,False,700,Even
701,Even Benjamin would often know what accelerate.,Even Benjamin would ever know what accelerate.,Even Benjamin would,often,ever,semantics,npi_licensing,npi_present_1,True,True,False,False,701,Even
