,sentence_good,sentence_bad,one_prefix_prefix,one_prefix_word_good,one_prefix_word_bad,field,linguistics_term,UID,simple_LM_method,one_prefix_method,two_prefix_method,lexically_identical,pairID,target
702,Even the banks often hope to irritate Catherine.,Even the banks ever hope to irritate Catherine.,Even the banks,often,ever,semantics,npi_licensing,npi_present_1,True,True,False,False,702,Even
703,Even the legislature really plans to work hard.,Even the legislature ever plans to work hard.,Even the legislature,really,ever,semantics,npi_licensing,npi_present_1,True,True,False,False,703,Even
704,Even many guests really complain.,Even many guests ever complain.,Even many guests,really,ever,semantics,npi_licensing,npi_present_1,True,True,False,False,704,Even
705,Even Lori often gets a job.,Even Lori ever gets a job.,Even Lori,often,ever,semantics,npi_licensing,npi_present_1,True,True,False,False,705,Even
706,Even some waiters really study.,Even some waiters ever study.,Even some waiters,really,ever,semantics,npi_licensing,npi_present_1,True,True,False,False,706,Even
707,Even the Borgias really need to climb up this mountain.,Even the Borgias ever need to climb up this mountain.,Even the Borgias,really,ever,semantics,npi_licensing,npi_present_1,True,True,False,False,707,Even
708,Even Wayne certainly paints.,Even Wayne ever paints.,Even Wayne,certainly,ever,semantics,npi_licensing,npi_present_1,True,True,False,False,708,Even
709,Even Bruce would also drop by some college campus.,Even Bruce would ever drop by some college campus.,Even Bruce would,also,ever,semantics,npi_licensing,npi_present_1,True,True,False,False,709,Even
710,Even these drivers certainly litter.,Even these drivers ever litter.,Even these drivers,certainly,ever,semantics,npi_licensing,npi_present_1,True,True,False,False,710,Even
711,Even a lot of students really annoys Naomi.,Even a lot of students ever annoys Naomi.,Even a lot of students,really,ever,semantics,npi_licensing,npi_present_1,True,True,False,False,711,Even
712,Even this committee also praises some actress.,Even this committee ever praises some actress.,Even this committee,also,ever,semantics,npi_licensing,npi_present_1,True,True,False,False,712,Even
713,Even Pamela does clearly climb down most hills.,Even Pamela does ever climb down most hills.,Even Pamela does,clearly,ever,semantics,npi_licensing,npi_present_1,True,True,False,False,713,Even
714,Even Jeffrey often drives to some malls.,Even Jeffrey ever drives to some malls.,Even Jeffrey,often,ever,semantics,npi_licensing,npi_present_1,True,True,False,False,714,Even
715,Even many teachers certainly skated around this museum.,Even many teachers ever skated around this museum.,Even many teachers,certainly,ever,semantics,npi_licensing,npi_present_1,True,True,False,False,715,Even
716,Even Ellen had really whispered.,Even Ellen had ever whispered.,Even Ellen had,really,ever,semantics,npi_licensing,npi_present_1,True,True,False,False,716,Even
717,Even Lawrence clearly cooks.,Even Lawrence ever cooks.,Even Lawrence,clearly,ever,semantics,npi_licensing,npi_present_1,True,True,False,False,717,Even
718,Even Eric has clearly examined some essays.,Even Eric has ever examined some essays.,Even Eric has,clearly,ever,semantics,npi_licensing,npi_present_1,True,True,False,False,718,Even
719,Even Winston Churchill really dislikes most newspaper articles.,Even Winston Churchill ever dislikes most newspaper articles.,Even Winston Churchill,really,ever,semantics,npi_licensing,npi_present_1,True,True,False,False,719,Even
720,Even some women certainly leave most actors.,Even some women ever leave most actors.,Even some women,certainly,ever,semantics,npi_licensing,npi_present_1,True,True,False,False,720,Even
721,Even Curtis often scans all newspaper articles.,Even Curtis ever scans all newspaper articles.,Even Curtis,often,ever,semantics,npi_licensing,npi_present_1,True,True,False,False,721,Even
722,Even all waitresses often suffer.,Even all waitresses ever suffer.,Even all waitresses,often,ever,semantics,npi_licensing,npi_present_1,True,True,False,False,722,Even
723,Even the Lutherans really skate around most hills.,Even the Lutherans ever skate around most hills.,Even the Lutherans,really,ever,semantics,npi_licensing,npi_present_1,True,True,False,False,723,Even
724,Even many shirts also unfolded.,Even many shirts ever unfolded.,Even many shirts,also,ever,semantics,npi_licensing,npi_present_1,True,True,False,False,724,Even
725,Even Bradley will really change.,Even Bradley will ever change.,Even Bradley will,really,ever,semantics,npi_licensing,npi_present_1,True,True,False,False,725,Even
726,Even many convertibles could certainly confuse Sheila.,Even many convertibles could ever confuse Sheila.,Even many convertibles could,certainly,ever,semantics,npi_licensing,npi_present_1,True,True,False,False,726,Even
727,Even Rodney can certainly clean some cake.,Even Rodney can ever clean some cake.,Even Rodney can,certainly,ever,semantics,npi_licensing,npi_present_1,True,True,False,False,727,Even
728,Even a lot of men also tempt Pamela to criticize Melissa.,Even a lot of men ever tempt Pamela to criticize Melissa.,Even a lot of men,also,ever,semantics,npi_licensing,npi_present_1,True,True,False,False,728,Even
729,Even all ladies have often escaped.,Even all ladies have ever escaped.,Even all ladies have,often,ever,semantics,npi_licensing,npi_present_1,True,True,False,False,729,Even
730,Even Grace certainly likes some movie theater.,Even Grace ever likes some movie theater.,Even Grace,certainly,ever,semantics,npi_licensing,npi_present_1,True,True,False,False,730,Even
731,Even the plates clearly shattered.,Even the plates ever shattered.,Even the plates,clearly,ever,semantics,npi_licensing,npi_present_1,True,True,False,False,731,Even
732,Even a doctor certainly researched that high school.,Even a doctor ever researched that high school.,Even a doctor,certainly,ever,semantics,npi_licensing,npi_present_1,True,True,False,False,732,Even
733,Even Christopher had certainly required Andrew to distract Edward.,Even Christopher had ever required Andrew to distract Edward.,Even Christopher had,certainly,ever,semantics,npi_licensing,npi_present_1,True,True,False,False,733,Even
734,Even Judy often thinks Rhonda copes.,Even Judy ever thinks Rhonda copes.,Even Judy,often,ever,semantics,npi_licensing,npi_present_1,True,True,False,False,734,Even
735,Even Vanessa clearly screams.,Even Vanessa ever screams.,Even Vanessa,clearly,ever,semantics,npi_licensing,npi_present_1,True,True,False,False,735,Even
736,Even the waitresses might also admire Deborah.,Even the waitresses might ever admire Deborah.,Even the waitresses might,also,ever,semantics,npi_licensing,npi_present_1,True,True,False,False,736,Even
737,Even Jason did clearly bake.,Even Jason did ever bake.,Even Jason did,clearly,ever,semantics,npi_licensing,npi_present_1,True,True,False,False,737,Even
738,Even a museum did certainly respond.,Even a museum did ever respond.,Even a museum did,certainly,ever,semantics,npi_licensing,npi_present_1,True,True,False,False,738,Even
739,Even Joseph often existed.,Even Joseph ever existed.,Even Joseph,often,ever,semantics,npi_licensing,npi_present_1,True,True,False,False,739,Even
740,Even Carrie has also talked to most girls.,Even Carrie has ever talked to most girls.,Even Carrie has,also,ever,semantics,npi_licensing,npi_present_1,True,True,False,False,740,Even
741,Even Douglas certainly compelled Rhonda's guest to joke around.,Even Douglas ever compelled Rhonda's guest to joke around.,Even Douglas,certainly,ever,semantics,npi_licensing,npi_present_1,True,True,False,False,741,Even
742,Even all documentaries clearly scare Sally.,Even all documentaries ever scare Sally.,Even all documentaries,clearly,ever,semantics,npi_licensing,npi_present_1,True,True,False,False,742,Even
743,Even Margaret had often disliked Jill.,Even Margaret had ever disliked Jill.,Even Margaret had,often,ever,semantics,npi_licensing,npi_present_1,True,True,False,False,743,Even
744,Even some guy really urges some daughters of Jerry to leave.,Even some guy ever urges some daughters of Jerry to leave.,Even some guy,really,ever,semantics,npi_licensing,npi_present_1,True,True,False,False,744,Even
745,Even Bethany will certainly walk through a mall.,Even Bethany will ever walk through a mall.,Even Bethany will,certainly,ever,semantics,npi_licensing,npi_present_1,True,True,False,False,745,Even
746,Even most waitresses certainly train.,Even most waitresses ever train.,Even most waitresses,certainly,ever,semantics,npi_licensing,npi_present_1,True,True,False,False,746,Even
747,Even a museum really reacted.,Even a museum ever reacted.,Even a museum,really,ever,semantics,npi_licensing,npi_present_1,True,True,False,False,747,Even
748,Even those men certainly pressure Rachel to explain everything.,Even those men ever pressure Rachel to explain everything.,Even those men,certainly,ever,semantics,npi_licensing,npi_present_1,True,True,False,False,748,Even
749,Even many museums also correspond.,Even many museums ever correspond.,Even many museums,also,ever,semantics,npi_licensing,npi_present_1,True,True,False,False,749,Even
750,Even dancers really practiced.,Even dancers ever practiced.,Even dancers,really,ever,semantics,npi_licensing,npi_present_1,True,True,False,False,750,Even
751,Even Amelia often has those malls.,Even Amelia ever has those malls.,Even Amelia,often,ever,semantics,npi_licensing,npi_present_1,True,True,False,False,751,Even
752,Even Margaret would clearly clean every high school.,Even Margaret would ever clean every high school.,Even Margaret would,clearly,ever,semantics,npi_licensing,npi_present_1,True,True,False,False,752,Even
753,Even the convertible also drops.,Even the convertible ever drops.,Even the convertible,also,ever,semantics,npi_licensing,npi_present_1,True,True,False,False,753,Even
754,Even Mark had certainly won.,Even Mark had ever won.,Even Mark had,certainly,ever,semantics,npi_licensing,npi_present_1,True,True,False,False,754,Even
755,Even Marla clearly had the plates.,Even Marla ever had the plates.,Even Marla,clearly,ever,semantics,npi_licensing,npi_present_1,True,True,False,False,755,Even
756,Even Joel has also fled from Brad.,Even Joel has ever fled from Brad.,Even Joel has,also,ever,semantics,npi_licensing,npi_present_1,True,True,False,False,756,Even
757,Even many carts also steer.,Even many carts ever steer.,Even many carts,also,ever,semantics,npi_licensing,npi_present_1,True,True,False,False,757,Even
758,Even drivers certainly run around the art gallery.,Even drivers ever run around the art gallery.,Even drivers,certainly,ever,semantics,npi_licensing,npi_present_1,True,True,False,False,758,Even
759,Even the boys really communicate.,Even the boys ever communicate.,Even the boys,really,ever,semantics,npi_licensing,npi_present_1,True,True,False,False,759,Even
760,Even Randolf often annoyed most girls.,Even Randolf ever annoyed most girls.,Even Randolf,often,ever,semantics,npi_licensing,npi_present_1,True,True,False,False,760,Even
761,Even some ladies clearly boast.,Even some ladies ever boast.,Even some ladies,clearly,ever,semantics,npi_licensing,npi_present_1,True,True,False,False,761,Even
762,Even that pepper does often grow.,Even that pepper does ever grow.,Even that pepper does,often,ever,semantics,npi_licensing,npi_present_1,True,True,False,False,762,Even
763,Even Margaret has often practiced.,Even Margaret has ever practiced.,Even Margaret has,often,ever,semantics,npi_licensing,npi_present_1,True,True,False,False,763,Even
764,Even those dishes had also vanished.,Even those dishes had ever vanished.,Even those dishes had,also,ever,semantics,npi_licensing,npi_present_1,True,True,False,False,764,Even
765,Even Travis clearly hunted.,Even Travis ever hunted.,Even Travis,clearly,ever,semantics,npi_licensing,npi_present_1,True,True,False,False,765,Even
766,Even Denise often joked around.,Even Denise ever joked around.,Even Denise,often,ever,semantics,npi_licensing,npi_present_1,True,True,False,False,766,Even
767,Even most governments have often worried.,Even most governments have ever worried.,Even most governments have,often,ever,semantics,npi_licensing,npi_present_1,True,True,False,False,767,Even
768,Even this dancer had really tried to pass the Great Lakes.,Even this dancer had ever tried to pass the Great Lakes.,Even this dancer had,really,ever,semantics,npi_licensing,npi_present_1,True,True,False,False,768,Even
769,Even the bicycle really rusted.,Even the bicycle ever rusted.,Even the bicycle,really,ever,semantics,npi_licensing,npi_present_1,True,True,False,False,769,Even
770,Even Lissa has clearly criticized Kirsten.,Even Lissa has ever criticized Kirsten.,Even Lissa has,clearly,ever,semantics,npi_licensing,npi_present_1,True,True,False,False,770,Even
771,Even Rebecca might really manage to get fired.,Even Rebecca might ever manage to get fired.,Even Rebecca might,really,ever,semantics,npi_licensing,npi_present_1,True,True,False,False,771,Even
772,Even the patient had really gone to some grocery store.,Even the patient had ever gone to some grocery store.,Even the patient had,really,ever,semantics,npi_licensing,npi_present_1,True,True,False,False,772,Even
773,Even all teenagers really kissed.,Even all teenagers ever kissed.,Even all teenagers,really,ever,semantics,npi_licensing,npi_present_1,True,True,False,False,773,Even
774,Even Russell has clearly toured a grocery store.,Even Russell has ever toured a grocery store.,Even Russell has,clearly,ever,semantics,npi_licensing,npi_present_1,True,True,False,False,774,Even
775,Even Jessica has often cleaned a restaurant.,Even Jessica has ever cleaned a restaurant.,Even Jessica has,often,ever,semantics,npi_licensing,npi_present_1,True,True,False,False,775,Even
776,Even Gerald also happened to boast.,Even Gerald ever happened to boast.,Even Gerald,also,ever,semantics,npi_licensing,npi_present_1,True,True,False,False,776,Even
777,Even a shawl clearly twirls.,Even a shawl ever twirls.,Even a shawl,clearly,ever,semantics,npi_licensing,npi_present_1,True,True,False,False,777,Even
778,Even Kathleen has really walked through the hill.,Even Kathleen has ever walked through the hill.,Even Kathleen has,really,ever,semantics,npi_licensing,npi_present_1,True,True,False,False,778,Even
779,Even Kristen really listens to a student.,Even Kristen ever listens to a student.,Even Kristen,really,ever,semantics,npi_licensing,npi_present_1,True,True,False,False,779,Even
780,Even Janet has often grinned.,Even Janet has ever grinned.,Even Janet has,often,ever,semantics,npi_licensing,npi_present_1,True,True,False,False,780,Even
781,Even some guy really irritated Thomas.,Even some guy ever irritated Thomas.,Even some guy,really,ever,semantics,npi_licensing,npi_present_1,True,True,False,False,781,Even
782,Even Sheila really vanished.,Even Sheila ever vanished.,Even Sheila,really,ever,semantics,npi_licensing,npi_present_1,True,True,False,False,782,Even
783,Even Omar certainly forced this sister of Sharon to descend every mountain.,Even Omar ever forced this sister of Sharon to descend every mountain.,Even Omar,certainly,ever,semantics,npi_licensing,npi_present_1,True,True,False,False,783,Even
784,Even Roger also smiles.,Even Roger ever smiles.,Even Roger,also,ever,semantics,npi_licensing,npi_present_1,True,True,False,False,784,Even
785,Even Alexander has also appreciated Ella.,Even Alexander has ever appreciated Ella.,Even Alexander has,also,ever,semantics,npi_licensing,npi_present_1,True,True,False,False,785,Even
786,Even that government often embarrasses Heidi.,Even that government ever embarrasses Heidi.,Even that government,often,ever,semantics,npi_licensing,npi_present_1,True,True,False,False,786,Even
787,Even Aaron really orders those grandfathers of Cheryl to lie.,Even Aaron ever orders those grandfathers of Cheryl to lie.,Even Aaron,really,ever,semantics,npi_licensing,npi_present_1,True,True,False,False,787,Even
788,Even these guys certainly refuse to interact.,Even these guys ever refuse to interact.,Even these guys,certainly,ever,semantics,npi_licensing,npi_present_1,True,True,False,False,788,Even
789,Even Travis had clearly climbed up stairs.,Even Travis had ever climbed up stairs.,Even Travis had,clearly,ever,semantics,npi_licensing,npi_present_1,True,True,False,False,789,Even
790,Even Suzanne often found Lori.,Even Suzanne ever found Lori.,Even Suzanne,often,ever,semantics,npi_licensing,npi_present_1,True,True,False,False,790,Even
791,Even Kendra will also laugh.,Even Kendra will ever laugh.,Even Kendra will,also,ever,semantics,npi_licensing,npi_present_1,True,True,False,False,791,Even
792,Even Gerald did also mess up an art gallery.,Even Gerald did ever mess up an art gallery.,Even Gerald did,also,ever,semantics,npi_licensing,npi_present_1,True,True,False,False,792,Even
793,Even some governments certainly encourage Nina to break those plates.,Even some governments ever encourage Nina to break those plates.,Even some governments,certainly,ever,semantics,npi_licensing,npi_present_1,True,True,False,False,793,Even
794,Even a lot of essays also hurt Jessica.,Even a lot of essays ever hurt Jessica.,Even a lot of essays,also,ever,semantics,npi_licensing,npi_present_1,True,True,False,False,794,Even
795,Even a lady also prefers Randolf to hug Vincent.,Even a lady ever prefers Randolf to hug Vincent.,Even a lady,also,ever,semantics,npi_licensing,npi_present_1,True,True,False,False,795,Even
796,Even Elaine often paints.,Even Elaine ever paints.,Even Elaine,often,ever,semantics,npi_licensing,npi_present_1,True,True,False,False,796,Even
797,Even many guys have really refused to care for the driver.,Even many guys have ever refused to care for the driver.,Even many guys have,really,ever,semantics,npi_licensing,npi_present_1,True,True,False,False,797,Even
798,Even that committee had often joked around.,Even that committee had ever joked around.,Even that committee had,often,ever,semantics,npi_licensing,npi_present_1,True,True,False,False,798,Even
799,Even Vincent has also managed to swallow.,Even Vincent has ever managed to swallow.,Even Vincent has,also,ever,semantics,npi_licensing,npi_present_1,True,True,False,False,799,Even
800,Even Sara also said these pedestrians seem to research Winston Churchill.,Even Sara ever said these pedestrians seem to research Winston Churchill.,Even Sara,also,ever,semantics,npi_licensing,npi_present_1,True,True,False,False,800,Even
801,Even boys often smile.,Even boys ever smile.,Even boys,often,ever,semantics,npi_licensing,npi_present_1,True,True,False,False,801,Even
802,Even Timothy really trained.,Even Timothy ever trained.,Even Timothy,really,ever,semantics,npi_licensing,npi_present_1,True,True,False,False,802,Even
803,Even Martin certainly confused Eric.,Even Martin ever confused Eric.,Even Martin,certainly,ever,semantics,npi_licensing,npi_present_1,True,True,False,False,803,Even
804,Even the pork can often confuse Leslie.,Even the pork can ever confuse Leslie.,Even the pork can,often,ever,semantics,npi_licensing,npi_present_1,True,True,False,False,804,Even
805,Even Todd had clearly disgusted Carl.,Even Todd had ever disgusted Carl.,Even Todd had,clearly,ever,semantics,npi_licensing,npi_present_1,True,True,False,False,805,Even
806,Even pies can clearly astound Jodi.,Even pies can ever astound Jodi.,Even pies can,clearly,ever,semantics,npi_licensing,npi_present_1,True,True,False,False,806,Even
807,Even some candle really brightens.,Even some candle ever brightens.,Even some candle,really,ever,semantics,npi_licensing,npi_present_1,True,True,False,False,807,Even
808,Even most drivers also continue to forfeit.,Even most drivers ever continue to forfeit.,Even most drivers,also,ever,semantics,npi_licensing,npi_present_1,True,True,False,False,808,Even
809,Even every casserole also burns.,Even every casserole ever burns.,Even every casserole,also,ever,semantics,npi_licensing,npi_present_1,True,True,False,False,809,Even
810,Even all dancers also bake.,Even all dancers ever bake.,Even all dancers,also,ever,semantics,npi_licensing,npi_present_1,True,True,False,False,810,Even
811,Even Carol really commissions a doctor's grandmothers to go to the lake.,Even Carol ever commissions a doctor's grandmothers to go to the lake.,Even Carol,really,ever,semantics,npi_licensing,npi_present_1,True,True,False,False,811,Even
812,Even Daniel often compromised.,Even Daniel ever compromised.,Even Daniel,often,ever,semantics,npi_licensing,npi_present_1,True,True,False,False,812,Even
813,Even some adults clearly sound like Rebecca.,Even some adults ever sound like Rebecca.,Even some adults,clearly,ever,semantics,npi_licensing,npi_present_1,True,True,False,False,813,Even
814,Even a lot of cashiers should clearly reply.,Even a lot of cashiers should ever reply.,Even a lot of cashiers should,clearly,ever,semantics,npi_licensing,npi_present_1,True,True,False,False,814,Even
815,Even Mitchell would also clean the couches.,Even Mitchell would ever clean the couches.,Even Mitchell would,also,ever,semantics,npi_licensing,npi_present_1,True,True,False,False,815,Even
816,Even some people should really assemble.,Even some people should ever assemble.,Even some people should,really,ever,semantics,npi_licensing,npi_present_1,True,True,False,False,816,Even
817,Even Tracy had really escaped.,Even Tracy had ever escaped.,Even Tracy had,really,ever,semantics,npi_licensing,npi_present_1,True,True,False,False,817,Even
818,Even Dennis really exercises.,Even Dennis ever exercises.,Even Dennis,really,ever,semantics,npi_licensing,npi_present_1,True,True,False,False,818,Even
819,Even some sweater can also flatten.,Even some sweater can ever flatten.,Even some sweater can,also,ever,semantics,npi_licensing,npi_present_1,True,True,False,False,819,Even
820,Even Nicole often continued to kiss Carrie.,Even Nicole ever continued to kiss Carrie.,Even Nicole,often,ever,semantics,npi_licensing,npi_present_1,True,True,False,False,820,Even
821,Even Sara certainly climbs up hills.,Even Sara ever climbs up hills.,Even Sara,certainly,ever,semantics,npi_licensing,npi_present_1,True,True,False,False,821,Even
822,Even Beth clearly thinks about most peppers.,Even Beth ever thinks about most peppers.,Even Beth,clearly,ever,semantics,npi_licensing,npi_present_1,True,True,False,False,822,Even
823,Even Candice also discovers what fall apart.,Even Candice ever discovers what fall apart.,Even Candice,also,ever,semantics,npi_licensing,npi_present_1,True,True,False,False,823,Even
824,Even Kendra really answered.,Even Kendra ever answered.,Even Kendra,really,ever,semantics,npi_licensing,npi_present_1,True,True,False,False,824,Even
825,Even some mushrooms have really burned.,Even some mushrooms have ever burned.,Even some mushrooms have,really,ever,semantics,npi_licensing,npi_present_1,True,True,False,False,825,Even
826,Even all waiters certainly ascertain all trucks to rust.,Even all waiters ever ascertain all trucks to rust.,Even all waiters,certainly,ever,semantics,npi_licensing,npi_present_1,True,True,False,False,826,Even
827,Even the drivers certainly hide Monet.,Even the drivers ever hide Monet.,Even the drivers,certainly,ever,semantics,npi_licensing,npi_present_1,True,True,False,False,827,Even
828,Even Mary had really practiced.,Even Mary had ever practiced.,Even Mary had,really,ever,semantics,npi_licensing,npi_present_1,True,True,False,False,828,Even
829,Even Diana does often speak up.,Even Diana does ever speak up.,Even Diana does,often,ever,semantics,npi_licensing,npi_present_1,True,True,False,False,829,Even
830,Even Julie can often stand up.,Even Julie can ever stand up.,Even Julie can,often,ever,semantics,npi_licensing,npi_present_1,True,True,False,False,830,Even
831,Even this truck might certainly drop.,Even this truck might ever drop.,Even this truck might,certainly,ever,semantics,npi_licensing,npi_present_1,True,True,False,False,831,Even
832,Even Jennifer really scanned that book.,Even Jennifer ever scanned that book.,Even Jennifer,really,ever,semantics,npi_licensing,npi_present_1,True,True,False,False,832,Even
833,Even April has really listened to many cashiers.,Even April has ever listened to many cashiers.,Even April has,really,ever,semantics,npi_licensing,npi_present_1,True,True,False,False,833,Even
834,Even Alicia often screamed.,Even Alicia ever screamed.,Even Alicia,often,ever,semantics,npi_licensing,npi_present_1,True,True,False,False,834,Even
835,Even Jodi clearly realizes who were profiting.,Even Jodi ever realizes who were profiting.,Even Jodi,clearly,ever,semantics,npi_licensing,npi_present_1,True,True,False,False,835,Even
836,Even Mitchell would clearly fix most unicycles.,Even Mitchell would ever fix most unicycles.,Even Mitchell would,clearly,ever,semantics,npi_licensing,npi_present_1,True,True,False,False,836,Even
837,Even Jill really encourages some libraries to like Steven.,Even Jill ever encourages some libraries to like Steven.,Even Jill,really,ever,semantics,npi_licensing,npi_present_1,True,True,False,False,837,Even
838,Even a lot of scarves have really frayed.,Even a lot of scarves have ever frayed.,Even a lot of scarves have,really,ever,semantics,npi_licensing,npi_present_1,True,True,False,False,838,Even
839,Even some child had clearly scratched.,Even some child had ever scratched.,Even some child had,clearly,ever,semantics,npi_licensing,npi_present_1,True,True,False,False,839,Even
840,Even the women also question Frank.,Even the women ever question Frank.,Even the women,also,ever,semantics,npi_licensing,npi_present_1,True,True,False,False,840,Even
841,Even some actresses have also married.,Even some actresses have ever married.,Even some actresses have,also,ever,semantics,npi_licensing,npi_present_1,True,True,False,False,841,Even
842,Even Donna does often like to help Janice.,Even Donna does ever like to help Janice.,Even Donna does,often,ever,semantics,npi_licensing,npi_present_1,True,True,False,False,842,Even
