,sentence_good,sentence_bad,one_prefix_prefix,one_prefix_word_good,one_prefix_word_bad,field,linguistics_term,UID,simple_LM_method,one_prefix_method,two_prefix_method,lexically_identical,pairID,target
0,Even Suzanne has really joked around.,Even Suzanne has ever joked around.,Even Suzanne has,really,ever,semantics,npi_licensing,npi_present_1,True,True,False,False,0,Even
1,Even many teenagers clearly boycott those legislatures.,Even many teenagers ever boycott those legislatures.,Even many teenagers,clearly,ever,semantics,npi_licensing,npi_present_1,True,True,False,False,1,Even
2,Even every cashier had clearly found out who hasn't sung.,Even every cashier had ever found out who hasn't sung.,Even every cashier had,clearly,ever,semantics,npi_licensing,npi_present_1,True,True,False,False,2,Even
3,Even Mark might often irritate the pedestrians.,Even Mark might ever irritate the pedestrians.,Even Mark might,often,ever,semantics,npi_licensing,npi_present_1,True,True,False,False,3,Even
4,Even Tara had really baked.,Even Tara had ever baked.,Even Tara had,really,ever,semantics,npi_licensing,npi_present_1,True,True,False,False,4,Even
5,Even these trucks have often slowed.,Even these trucks have ever slowed.,Even these trucks have,often,ever,semantics,npi_licensing,npi_present_1,True,True,False,False,5,Even
6,Even Deanna did also require Rodney to disappear.,Even Deanna did ever require Rodney to disappear.,Even Deanna did,also,ever,semantics,npi_licensing,npi_present_1,True,True,False,False,6,Even
7,Even Galileo really climbs down these hills.,Even Galileo ever climbs down these hills.,Even Galileo,really,ever,semantics,npi_licensing,npi_present_1,True,True,False,False,7,Even
8,Even a lot of lamps often brighten.,Even a lot of lamps ever brighten.,Even a lot of lamps,often,ever,semantics,npi_licensing,npi_present_1,True,True,False,False,8,Even
9,Even Brad often convinces John's doctors to debate.,Even Brad ever convinces John's doctors to debate.,Even Brad,often,ever,semantics,npi_licensing,npi_present_1,True,True,False,False,9,Even
10,Even this carriage also maneuvers.,Even this carriage ever maneuvers.,Even this carriage,also,ever,semantics,npi_licensing,npi_present_1,True,True,False,False,10,Even
11,Even a muffin can certainly blacken.,Even a muffin can ever blacken.,Even a muffin can,certainly,ever,semantics,npi_licensing,npi_present_1,True,True,False,False,11,Even
12,Even Wayne had also answered.,Even Wayne had ever answered.,Even Wayne had,also,ever,semantics,npi_licensing,npi_present_1,True,True,False,False,12,Even
13,Even that shawl often frays.,Even that shawl ever frays.,Even that shawl,often,ever,semantics,npi_licensing,npi_present_1,True,True,False,False,13,Even
14,Even Susan could also clean this screen.,Even Susan could ever clean this screen.,Even Susan could,also,ever,semantics,npi_licensing,npi_present_1,True,True,False,False,14,Even
15,Even many birds can really bore Kimberley.,Even many birds can ever bore Kimberley.,Even many birds can,really,ever,semantics,npi_licensing,npi_present_1,True,True,False,False,15,Even
16,Even some universities had really communicated.,Even some universities had ever communicated.,Even some universities had,really,ever,semantics,npi_licensing,npi_present_1,True,True,False,False,16,Even
17,Even Alexander should often blink.,Even Alexander should ever blink.,Even Alexander should,often,ever,semantics,npi_licensing,npi_present_1,True,True,False,False,17,Even
18,Even these legislatures certainly assembled.,Even these legislatures ever assembled.,Even these legislatures,certainly,ever,semantics,npi_licensing,npi_present_1,True,True,False,False,18,Even
19,Even these drivers do also assemble.,Even these drivers do ever assemble.,Even these drivers do,also,ever,semantics,npi_licensing,npi_present_1,True,True,False,False,19,Even
20,Even Patrick also flees from Sherry.,Even Patrick ever flees from Sherry.,Even Patrick,also,ever,semantics,npi_licensing,npi_present_1,True,True,False,False,20,Even
21,Even a boy has also researched all restaurants.,Even a boy has ever researched all restaurants.,Even a boy has,also,ever,semantics,npi_licensing,npi_present_1,True,True,False,False,21,Even
22,Even a hat certainly twisted.,Even a hat ever twisted.,Even a hat,certainly,ever,semantics,npi_licensing,npi_present_1,True,True,False,False,22,Even
23,Even Raymond certainly revealed who didn't doubt all teenagers complain.,Even Raymond ever revealed who didn't doubt all teenagers complain.,Even Raymond,certainly,ever,semantics,npi_licensing,npi_present_1,True,True,False,False,23,Even
24,Even George would clearly wash.,Even George would ever wash.,Even George would,clearly,ever,semantics,npi_licensing,npi_present_1,True,True,False,False,24,Even
25,Even Cynthia had often examined essays.,Even Cynthia had ever examined essays.,Even Cynthia had,often,ever,semantics,npi_licensing,npi_present_1,True,True,False,False,25,Even
26,Even the Borgias really remember Marla.,Even the Borgias ever remember Marla.,Even the Borgias,really,ever,semantics,npi_licensing,npi_present_1,True,True,False,False,26,Even
27,Even the guys often embrace.,Even the guys ever embrace.,Even the guys,often,ever,semantics,npi_licensing,npi_present_1,True,True,False,False,27,Even
28,Even Danielle also leaves.,Even Danielle ever leaves.,Even Danielle,also,ever,semantics,npi_licensing,npi_present_1,True,True,False,False,28,Even
29,Even a shirt certainly tightens.,Even a shirt ever tightens.,Even a shirt,certainly,ever,semantics,npi_licensing,npi_present_1,True,True,False,False,29,Even
30,Even some closet really shuts.,Even some closet ever shuts.,Even some closet,really,ever,semantics,npi_licensing,npi_present_1,True,True,False,False,30,Even
31,Even this teacher can also discover Heather.,Even this teacher can ever discover Heather.,Even this teacher can,also,ever,semantics,npi_licensing,npi_present_1,True,True,False,False,31,Even
32,Even Dana had certainly investigated Gary.,Even Dana had ever investigated Gary.,Even Dana had,certainly,ever,semantics,npi_licensing,npi_present_1,True,True,False,False,32,Even
33,Even Peter has clearly shrugged.,Even Peter has ever shrugged.,Even Peter has,clearly,ever,semantics,npi_licensing,npi_present_1,True,True,False,False,33,Even
34,Even Ellen also wastes away.,Even Ellen ever wastes away.,Even Ellen,also,ever,semantics,npi_licensing,npi_present_1,True,True,False,False,34,Even
35,Even some cashier had clearly fixed this computer.,Even some cashier had ever fixed this computer.,Even some cashier had,clearly,ever,semantics,npi_licensing,npi_present_1,True,True,False,False,35,Even
36,Even Kevin will also walk through the hospital.,Even Kevin will ever walk through the hospital.,Even Kevin will,also,ever,semantics,npi_licensing,npi_present_1,True,True,False,False,36,Even
37,Even Eva had certainly woken up.,Even Eva had ever woken up.,Even Eva had,certainly,ever,semantics,npi_licensing,npi_present_1,True,True,False,False,37,Even
38,Even a cart clearly chips.,Even a cart ever chips.,Even a cart,clearly,ever,semantics,npi_licensing,npi_present_1,True,True,False,False,38,Even
39,Even these cats had really climbed down these steps.,Even these cats had ever climbed down these steps.,Even these cats had,really,ever,semantics,npi_licensing,npi_present_1,True,True,False,False,39,Even
40,Even Jerry also visited these schools.,Even Jerry ever visited these schools.,Even Jerry,also,ever,semantics,npi_licensing,npi_present_1,True,True,False,False,40,Even
41,Even every blouse also crumpled.,Even every blouse ever crumpled.,Even every blouse,also,ever,semantics,npi_licensing,npi_present_1,True,True,False,False,41,Even
42,Even a lot of men had really married.,Even a lot of men had ever married.,Even a lot of men had,really,ever,semantics,npi_licensing,npi_present_1,True,True,False,False,42,Even
43,Even some hospital can also retaliate.,Even some hospital can ever retaliate.,Even some hospital can,also,ever,semantics,npi_licensing,npi_present_1,True,True,False,False,43,Even
44,Even customers really assemble.,Even customers ever assemble.,Even customers,really,ever,semantics,npi_licensing,npi_present_1,True,True,False,False,44,Even
45,Even Tara has certainly baked.,Even Tara has ever baked.,Even Tara has,certainly,ever,semantics,npi_licensing,npi_present_1,True,True,False,False,45,Even
46,Even many hospitals clearly advise Florence to hunt.,Even many hospitals ever advise Florence to hunt.,Even many hospitals,clearly,ever,semantics,npi_licensing,npi_present_1,True,True,False,False,46,Even
47,Even most children really fall asleep.,Even most children ever fall asleep.,Even most children,really,ever,semantics,npi_licensing,npi_present_1,True,True,False,False,47,Even
48,Even Veronica often fell asleep.,Even Veronica ever fell asleep.,Even Veronica,often,ever,semantics,npi_licensing,npi_present_1,True,True,False,False,48,Even
49,Even some skateboards clearly rust.,Even some skateboards ever rust.,Even some skateboards,clearly,ever,semantics,npi_licensing,npi_present_1,True,True,False,False,49,Even
50,Even this hospital has also met.,Even this hospital has ever met.,Even this hospital has,also,ever,semantics,npi_licensing,npi_present_1,True,True,False,False,50,Even
51,Even all movie theaters often appear.,Even all movie theaters ever appear.,Even all movie theaters,often,ever,semantics,npi_licensing,npi_present_1,True,True,False,False,51,Even
52,Even Steve certainly murmurs.,Even Steve ever murmurs.,Even Steve,certainly,ever,semantics,npi_licensing,npi_present_1,True,True,False,False,52,Even
53,Even Joel clearly wins.,Even Joel ever wins.,Even Joel,clearly,ever,semantics,npi_licensing,npi_present_1,True,True,False,False,53,Even
54,Even all hats could clearly fray.,Even all hats could ever fray.,Even all hats could,clearly,ever,semantics,npi_licensing,npi_present_1,True,True,False,False,54,Even
55,Even Rose could often dislike Brian.,Even Rose could ever dislike Brian.,Even Rose could,often,ever,semantics,npi_licensing,npi_present_1,True,True,False,False,55,Even
56,Even Ella certainly pressures the Lutherans to benefit.,Even Ella ever pressures the Lutherans to benefit.,Even Ella,certainly,ever,semantics,npi_licensing,npi_present_1,True,True,False,False,56,Even
57,Even some beef clearly aggravates a lady.,Even some beef ever aggravates a lady.,Even some beef,clearly,ever,semantics,npi_licensing,npi_present_1,True,True,False,False,57,Even
58,Even Donald also praised Lisa.,Even Donald ever praised Lisa.,Even Donald,also,ever,semantics,npi_licensing,npi_present_1,True,True,False,False,58,Even
59,Even these companies should clearly fail to hurt that student.,Even these companies should ever fail to hurt that student.,Even these companies should,clearly,ever,semantics,npi_licensing,npi_present_1,True,True,False,False,59,Even
60,Even the waiters had certainly seemed to criticize Stacey.,Even the waiters had ever seemed to criticize Stacey.,Even the waiters had,certainly,ever,semantics,npi_licensing,npi_present_1,True,True,False,False,60,Even
61,Even Tiffany will really forget who vanishes.,Even Tiffany will ever forget who vanishes.,Even Tiffany will,really,ever,semantics,npi_licensing,npi_present_1,True,True,False,False,61,Even
62,Even Steve also boycotts this organization.,Even Steve ever boycotts this organization.,Even Steve,also,ever,semantics,npi_licensing,npi_present_1,True,True,False,False,62,Even
63,Even Bradley often passes the Great Lakes.,Even Bradley ever passes the Great Lakes.,Even Bradley,often,ever,semantics,npi_licensing,npi_present_1,True,True,False,False,63,Even
64,Even Bill had often refused to leave.,Even Bill had ever refused to leave.,Even Bill had,often,ever,semantics,npi_licensing,npi_present_1,True,True,False,False,64,Even
65,Even Benjamin had certainly prompted the waitress to sell that ladder.,Even Benjamin had ever prompted the waitress to sell that ladder.,Even Benjamin had,certainly,ever,semantics,npi_licensing,npi_present_1,True,True,False,False,65,Even
66,Even many children really suffer.,Even many children ever suffer.,Even many children,really,ever,semantics,npi_licensing,npi_present_1,True,True,False,False,66,Even
67,Even Deanna did certainly yell.,Even Deanna did ever yell.,Even Deanna did,certainly,ever,semantics,npi_licensing,npi_present_1,True,True,False,False,67,Even
68,Even Marla really explains Omar hasn't cleaned some library.,Even Marla ever explains Omar hasn't cleaned some library.,Even Marla,really,ever,semantics,npi_licensing,npi_present_1,True,True,False,False,68,Even
69,Even some dancers certainly scan many movies.,Even some dancers ever scan many movies.,Even some dancers,certainly,ever,semantics,npi_licensing,npi_present_1,True,True,False,False,69,Even
70,Even most patients also donate.,Even most patients ever donate.,Even most patients,also,ever,semantics,npi_licensing,npi_present_1,True,True,False,False,70,Even
71,Even some men certainly die.,Even some men ever die.,Even some men,certainly,ever,semantics,npi_licensing,npi_present_1,True,True,False,False,71,Even
72,Even Janet certainly sounded like Theresa.,Even Janet ever sounded like Theresa.,Even Janet,certainly,ever,semantics,npi_licensing,npi_present_1,True,True,False,False,72,Even
73,Even eggplants had also blackened.,Even eggplants had ever blackened.,Even eggplants had,also,ever,semantics,npi_licensing,npi_present_1,True,True,False,False,73,Even
74,Even Patricia really forgets a lot of women.,Even Patricia ever forgets a lot of women.,Even Patricia,really,ever,semantics,npi_licensing,npi_present_1,True,True,False,False,74,Even
75,Even this actor really plays.,Even this actor ever plays.,Even this actor,really,ever,semantics,npi_licensing,npi_present_1,True,True,False,False,75,Even
76,Even Laura certainly believes Emily to eat.,Even Laura ever believes Emily to eat.,Even Laura,certainly,ever,semantics,npi_licensing,npi_present_1,True,True,False,False,76,Even
77,Even Kevin has certainly existed.,Even Kevin has ever existed.,Even Kevin has,certainly,ever,semantics,npi_licensing,npi_present_1,True,True,False,False,77,Even
78,Even these guests had really wondered what doesn't brighten.,Even these guests had ever wondered what doesn't brighten.,Even these guests had,really,ever,semantics,npi_licensing,npi_present_1,True,True,False,False,78,Even
79,Even the pedestrians really approached Stacy.,Even the pedestrians ever approached Stacy.,Even the pedestrians,really,ever,semantics,npi_licensing,npi_present_1,True,True,False,False,79,Even
80,Even Richard often pushes every doctor's sons to whisper.,Even Richard ever pushes every doctor's sons to whisper.,Even Richard,often,ever,semantics,npi_licensing,npi_present_1,True,True,False,False,80,Even
81,Even Joseph would really force Guy to weep.,Even Joseph would ever force Guy to weep.,Even Joseph would,really,ever,semantics,npi_licensing,npi_present_1,True,True,False,False,81,Even
82,Even John clearly forgot about who hadn't worried.,Even John ever forgot about who hadn't worried.,Even John,clearly,ever,semantics,npi_licensing,npi_present_1,True,True,False,False,82,Even
83,Even the ice cream clearly froze.,Even the ice cream ever froze.,Even the ice cream,clearly,ever,semantics,npi_licensing,npi_present_1,True,True,False,False,83,Even
84,Even Susan could often exist.,Even Susan could ever exist.,Even Susan could,often,ever,semantics,npi_licensing,npi_present_1,True,True,False,False,84,Even
85,Even Jessica had also prevented this pork from impressing actresses.,Even Jessica had ever prevented this pork from impressing actresses.,Even Jessica had,also,ever,semantics,npi_licensing,npi_present_1,True,True,False,False,85,Even
86,Even Diane did certainly care for Noah.,Even Diane did ever care for Noah.,Even Diane did,certainly,ever,semantics,npi_licensing,npi_present_1,True,True,False,False,86,Even
87,Even Mitchell has clearly skated around this restaurant.,Even Mitchell has ever skated around this restaurant.,Even Mitchell has,clearly,ever,semantics,npi_licensing,npi_present_1,True,True,False,False,87,Even
88,Even Catherine can often grin.,Even Catherine can ever grin.,Even Catherine can,often,ever,semantics,npi_licensing,npi_present_1,True,True,False,False,88,Even
89,Even those eggplants also go bad.,Even those eggplants ever go bad.,Even those eggplants,also,ever,semantics,npi_licensing,npi_present_1,True,True,False,False,89,Even
90,Even this dancer could really wash.,Even this dancer could ever wash.,Even this dancer could,really,ever,semantics,npi_licensing,npi_present_1,True,True,False,False,90,Even
91,Even these pants can also tighten.,Even these pants can ever tighten.,Even these pants can,also,ever,semantics,npi_licensing,npi_present_1,True,True,False,False,91,Even
92,Even all dancers clearly entreat April to take every school.,Even all dancers ever entreat April to take every school.,Even all dancers,clearly,ever,semantics,npi_licensing,npi_present_1,True,True,False,False,92,Even
93,Even Daniel often cooperates.,Even Daniel ever cooperates.,Even Daniel,often,ever,semantics,npi_licensing,npi_present_1,True,True,False,False,93,Even
94,Even Connie will also forfeit.,Even Connie will ever forfeit.,Even Connie will,also,ever,semantics,npi_licensing,npi_present_1,True,True,False,False,94,Even
95,Even Veronica also swayed Sarah's best friend to spin around.,Even Veronica ever swayed Sarah's best friend to spin around.,Even Veronica,also,ever,semantics,npi_licensing,npi_present_1,True,True,False,False,95,Even
96,Even people certainly walked through some public park.,Even people ever walked through some public park.,Even people,certainly,ever,semantics,npi_licensing,npi_present_1,True,True,False,False,96,Even
97,Even Alexander has really climbed up the ladders.,Even Alexander has ever climbed up the ladders.,Even Alexander has,really,ever,semantics,npi_licensing,npi_present_1,True,True,False,False,97,Even
98,Even Gregory might also practice.,Even Gregory might ever practice.,Even Gregory might,also,ever,semantics,npi_licensing,npi_present_1,True,True,False,False,98,Even
99,Even a lot of pedestrians could certainly collaborate.,Even a lot of pedestrians could ever collaborate.,Even a lot of pedestrians could,certainly,ever,semantics,npi_licensing,npi_present_1,True,True,False,False,99,Even
100,Even that boy clearly wept.,Even that boy ever wept.,Even that boy,clearly,ever,semantics,npi_licensing,npi_present_1,True,True,False,False,100,Even
101,Even Eric certainly asks Wayne to annoy Diane.,Even Eric ever asks Wayne to annoy Diane.,Even Eric,certainly,ever,semantics,npi_licensing,npi_present_1,True,True,False,False,101,Even
102,Even Janet should certainly cry.,Even Janet should ever cry.,Even Janet should,certainly,ever,semantics,npi_licensing,npi_present_1,True,True,False,False,102,Even
103,Even Stacey really tries to investigate Keith.,Even Stacey ever tries to investigate Keith.,Even Stacey,really,ever,semantics,npi_licensing,npi_present_1,True,True,False,False,103,Even
104,Even Elizabeth clearly scratches.,Even Elizabeth ever scratches.,Even Elizabeth,clearly,ever,semantics,npi_licensing,npi_present_1,True,True,False,False,104,Even
105,Even Vanessa clearly scans the books.,Even Vanessa ever scans the books.,Even Vanessa,clearly,ever,semantics,npi_licensing,npi_present_1,True,True,False,False,105,Even
106,Even Tonya certainly motivated Samantha to return to lakes.,Even Tonya ever motivated Samantha to return to lakes.,Even Tonya,certainly,ever,semantics,npi_licensing,npi_present_1,True,True,False,False,106,Even
107,Even some skirts certainly bother Becca.,Even some skirts ever bother Becca.,Even some skirts,certainly,ever,semantics,npi_licensing,npi_present_1,True,True,False,False,107,Even
108,Even most doctors also wave.,Even most doctors ever wave.,Even most doctors,also,ever,semantics,npi_licensing,npi_present_1,True,True,False,False,108,Even
109,Even Margaret can certainly want to clean the hospital.,Even Margaret can ever want to clean the hospital.,Even Margaret can,certainly,ever,semantics,npi_licensing,npi_present_1,True,True,False,False,109,Even
110,Even most actresses have also testified.,Even most actresses have ever testified.,Even most actresses have,also,ever,semantics,npi_licensing,npi_present_1,True,True,False,False,110,Even
111,Even Alice had certainly obligated Brenda to take the pants.,Even Alice had ever obligated Brenda to take the pants.,Even Alice had,certainly,ever,semantics,npi_licensing,npi_present_1,True,True,False,False,111,Even
112,Even Beth really seems to answer.,Even Beth ever seems to answer.,Even Beth,really,ever,semantics,npi_licensing,npi_present_1,True,True,False,False,112,Even
113,Even Steve had also remembered Teresa.,Even Steve had ever remembered Teresa.,Even Steve had,also,ever,semantics,npi_licensing,npi_present_1,True,True,False,False,113,Even
114,Even Benjamin often neglects to scream.,Even Benjamin ever neglects to scream.,Even Benjamin,often,ever,semantics,npi_licensing,npi_present_1,True,True,False,False,114,Even
115,Even Richard can really commission those museums to bore Roger.,Even Richard can ever commission those museums to bore Roger.,Even Richard can,really,ever,semantics,npi_licensing,npi_present_1,True,True,False,False,115,Even
116,Even some adults also chuckled.,Even some adults ever chuckled.,Even some adults,also,ever,semantics,npi_licensing,npi_present_1,True,True,False,False,116,Even
117,Even the teenager certainly practices.,Even the teenager ever practices.,Even the teenager,certainly,ever,semantics,npi_licensing,npi_present_1,True,True,False,False,117,Even
118,Even many customers really benefited.,Even many customers ever benefited.,Even many customers,really,ever,semantics,npi_licensing,npi_present_1,True,True,False,False,118,Even
119,Even Mitchell often predicts some tomato to scorch.,Even Mitchell ever predicts some tomato to scorch.,Even Mitchell,often,ever,semantics,npi_licensing,npi_present_1,True,True,False,False,119,Even
120,Even Christine did really hide teenagers.,Even Christine did ever hide teenagers.,Even Christine did,really,ever,semantics,npi_licensing,npi_present_1,True,True,False,False,120,Even
121,Even Renee often insults Nicole.,Even Renee ever insults Nicole.,Even Renee,often,ever,semantics,npi_licensing,npi_present_1,True,True,False,False,121,Even
122,Even dancers have often disagreed.,Even dancers have ever disagreed.,Even dancers have,often,ever,semantics,npi_licensing,npi_present_1,True,True,False,False,122,Even
123,Even Maria has certainly spun around.,Even Maria has ever spun around.,Even Maria has,certainly,ever,semantics,npi_licensing,npi_present_1,True,True,False,False,123,Even
124,Even most apples have certainly gone bad.,Even most apples have ever gone bad.,Even most apples have,certainly,ever,semantics,npi_licensing,npi_present_1,True,True,False,False,124,Even
125,Even those adults also grin.,Even those adults ever grin.,Even those adults,also,ever,semantics,npi_licensing,npi_present_1,True,True,False,False,125,Even
126,Even the Impressionists clearly yearn to telephone.,Even the Impressionists ever yearn to telephone.,Even the Impressionists,clearly,ever,semantics,npi_licensing,npi_present_1,True,True,False,False,126,Even
127,Even these libraries clearly compel some guy's associates to play.,Even these libraries ever compel some guy's associates to play.,Even these libraries,clearly,ever,semantics,npi_licensing,npi_present_1,True,True,False,False,127,Even
128,Even Melinda had certainly suffered.,Even Melinda had ever suffered.,Even Melinda had,certainly,ever,semantics,npi_licensing,npi_present_1,True,True,False,False,128,Even
129,Even George has also washed.,Even George has ever washed.,Even George has,also,ever,semantics,npi_licensing,npi_present_1,True,True,False,False,129,Even
130,Even Cheryl clearly slumped over.,Even Cheryl ever slumped over.,Even Cheryl,clearly,ever,semantics,npi_licensing,npi_present_1,True,True,False,False,130,Even
131,Even Melinda had often swallowed.,Even Melinda had ever swallowed.,Even Melinda had,often,ever,semantics,npi_licensing,npi_present_1,True,True,False,False,131,Even
132,Even Candice also heals all cashiers.,Even Candice ever heals all cashiers.,Even Candice,also,ever,semantics,npi_licensing,npi_present_1,True,True,False,False,132,Even
133,Even Carolyn could really observe Rhonda.,Even Carolyn could ever observe Rhonda.,Even Carolyn could,really,ever,semantics,npi_licensing,npi_present_1,True,True,False,False,133,Even
134,Even Helen certainly hides Rhonda.,Even Helen ever hides Rhonda.,Even Helen,certainly,ever,semantics,npi_licensing,npi_present_1,True,True,False,False,134,Even
135,Even hats clearly stretched.,Even hats ever stretched.,Even hats,clearly,ever,semantics,npi_licensing,npi_present_1,True,True,False,False,135,Even
136,Even James really visits this boy.,Even James ever visits this boy.,Even James,really,ever,semantics,npi_licensing,npi_present_1,True,True,False,False,136,Even
137,Even the cashiers clearly go to the schools.,Even the cashiers ever go to the schools.,Even the cashiers,clearly,ever,semantics,npi_licensing,npi_present_1,True,True,False,False,137,Even
138,Even some sweaters also shrink.,Even some sweaters ever shrink.,Even some sweaters,also,ever,semantics,npi_licensing,npi_present_1,True,True,False,False,138,Even
139,Even most universities certainly propose to protest.,Even most universities ever propose to protest.,Even most universities,certainly,ever,semantics,npi_licensing,npi_present_1,True,True,False,False,139,Even
140,Even Connie really discovers Adam to question Ellen.,Even Connie ever discovers Adam to question Ellen.,Even Connie,really,ever,semantics,npi_licensing,npi_present_1,True,True,False,False,140,Even
141,Even Donald certainly writes.,Even Donald ever writes.,Even Donald,certainly,ever,semantics,npi_licensing,npi_present_1,True,True,False,False,141,Even
